id,sentence,claims,focus,coverage,redundance,model,user,cross_focus,cross_coverage,cross_users
712,4797,"Lake Powell is a reservoir on the Colorado River.
Lake Powell straddles the border between Utah and Arizona.
Most of Lake Powell, along with Rainbow Bridge, is in Utah.
Lake Powell is a major vacation spot.
Around two million people visit Lake Powell every year.",11000,1111,00000,gpt-4-turbo-3-shot,353,11000,1111,353
713,4992,"The Beatles have had the most number-one albums on the British charts.
The Beatles have sold more singles in the UK than any other act.
The Beatles are the best-selling music artists in the United States according to the RIAA.
The Beatles have 178 million certified units in the United States.
The Beatles topped Billboard magazine's list of the all-time most successful 'Hot 100' artists in 2008.
The Beatles hold the record for most number-one hits on the Hot 100 chart with twenty.",,,,gpt-4-turbo-3-shot,,,,
714,4078,"Allegiant is a novel.
Allegiant was published by Katherine Tegen Books.
Allegiant was published by HarperCollins Children's Books in the U.K.
The World of Divergent: The Path to Allegiant is a companion book to the trilogy.
The World of Divergent: The Path to Allegiant was released for free electronically.
The World of Divergent: The Path to Allegiant was released four weeks before Allegiant.
Allegiant is being adapted into a two-part film.
The first part of the Allegiant film adaptation was released on March 18, 2016.",10000010,00000,00000000,gpt-4-turbo-3-shot,357,"10000010,10000010","00000,00000","357,357"
715,3727,"The Dark Knight features the DC Comics character Batman.
The Dark Knight is part of Nolan's The Dark Knight Trilogy.
The Dark Knight is a sequel to Batman Begins.
The Dark Knight was released after 2005.
Christian Bale stars in The Dark Knight.
Michael Caine is part of The Dark Knight's ensemble cast.
Heath Ledger acts in The Dark Knight.
Gary Oldman is featured in The Dark Knight.
Aaron Eckhart appears in The Dark Knight.
Maggie Gyllenhaal is a cast member of The Dark Knight.
Morgan Freeman stars in The Dark Knight.
Bruce Wayne/Batman is played by Christian Bale in The Dark Knight.
James Gordon is portrayed by Gary Oldman in The Dark Knight.
Harvey Dent is played by Aaron Eckhart in The Dark Knight.
The Joker is a character in The Dark Knight played by Heath Ledger.
The Dark Knight's plot involves an alliance to dismantle organized crime in Gotham City.
The Joker seeks to undermine Batman's influence in The Dark Knight.
The Joker aims to create chaos in Gotham City in The Dark Knight.
Nolan was inspired by the Joker's comic book debut in 1940 for The Dark Knight.
The Killing Joke graphic novel from 1988 inspired Nolan for The Dark Knight.
The Long Halloween series from 1996 influenced Nolan's The Dark Knight.",,,,gpt-4-turbo-3-shot,,,,
716,373,"Dean Martin was born on June 7, 1917.
Dean Martin died on December 25, 1995.
Dean Martin's birth name was Dino Paul Crocetti.
Dean Martin was an Italian-American.
Dean Martin was a singer.
Dean Martin was an actor.
Dean Martin was a comedian.
Dean Martin was a film producer.
Dean Martin was an entertainer in the mid-20th century.
Dean Martin was nicknamed the 'King of Cool'.",,,,gpt-4-turbo-3-shot,,,,
717,4313,"Joseph Goebbels was the Propaganda Minister of Nazi Germany.
Joseph Goebbels utilized film for propaganda.
Joseph Goebbels utilized mass rallies for propaganda.
Joseph Goebbels utilized Hitler's oratory for propaganda.
Nazi Germany's government controlled public opinion.
Nazi Germany's government controlled artistic expression.
Nazi Germany promoted specific art forms.
Nazi Germany banned or discouraged certain art forms.
Nazi Germany made territorial demands in the late 1930s.
Nazi Germany threatened war over territorial demands.",,,,gpt-4-turbo-3-shot,,,,
718,3394,"Michael Fassbender was born on 2 April 1977.
Michael Fassbender is an actor.
Michael Fassbender was born in Germany.
Michael Fassbender is Irish.
Michael Fassbender's feature film debut was in 300.
Michael Fassbender played a Spartan warrior in 300.
Michael Fassbender's film debut was in 2007.
Michael Fassbender has performed in stage productions.
Michael Fassbender starred in the HBO miniseries Band of Brothers.
Michael Fassbender starred in the Sky One fantasy drama Hex.
Michael Fassbender's role in Hex occurred between 2004 and 2005.",,,,gpt-4-turbo-3-shot,,,,
719,4966,"Several remix versions of 'Despacito' were released.
A solo pop version of 'Despacito' was released on March 17, 2017.
A salsa version of 'Despacito' featuring Victor Manuelle was released on March 17, 2017.
Victor Manuelle is a Puerto Rican musician.
A remix version of 'Despacito' featuring Justin Bieber was released on April 17, 2017.
Justin Bieber is a Canadian singer.
The Justin Bieber remix of 'Despacito' improved the song's chart performance in the English-speaking world.",,,,gpt-4-turbo-3-shot,,,,
720,1048,"Ozzy Osbourne was the lead vocalist of Black Sabbath.
Ozzy Osbourne became prominent in the early 1970s.
Ozzy Osbourne was fired from Black Sabbath in 1979.
Ozzy Osbourne had a successful solo career.
Ozzy Osbourne released 11 studio albums.
Ozzy Osbourne's first seven solo albums were multi-platinum certified in the US.
Ozzy Osbourne reunited with Black Sabbath on several occasions.
Ozzy Osbourne recorded the album 13 with Black Sabbath in 2013.",00101000,11,00000000,gpt-4-turbo-3-shot,358,00101000,11,358
721,271,"Miley Cyrus was born on November 23, 1992.
Miley Cyrus' birth name is Destiny Hope Cyrus.
Miley Cyrus is an American singer.
Miley Cyrus is a songwriter.
Miley Cyrus is an actress.
Miley Cyrus played minor roles in the television series Doc.
Miley Cyrus appeared in the film Big Fish during her childhood.
Miley Cyrus became a teen idol in 2006.
Miley Cyrus starred as Miley Stewart in Hannah Montana.
Miley Cyrus' role in Hannah Montana was on the Disney Channel.",,,,gpt-4-turbo-3-shot,,,,
722,3170,"The G20's inaugural leaders' summit was in 2008.
The G20 leaders announced on 25 September 2009 that it would replace the G8.
The G20 is considered the main economic council of wealthy nations.
The G20 has been criticized for its membership policies.
Intellectuals have criticized the G20's membership policies.
G20 summits have been the focus of major protests.
Anti-globalists have protested at G20 summits.
Nationalists have protested at G20 summits.
The heads of the G20 nations met semi-annually between 2009 and 2010.
The G20 held summits semi-annually between 2009 and 2010.",,,,gpt-4-turbo-3-shot,,,,
723,2494,"Amerigo Vespucci was an Italian explorer.
Amerigo Vespucci was a financier.
Amerigo Vespucci was a navigator.
Amerigo Vespucci was a cartographer.
Amerigo Vespucci demonstrated that Brazil and the West Indies were not part of Asia.
Amerigo Vespucci was born on March 9, 1454.
Amerigo Vespucci died on February 22, 1512.
The New World is a term colloquially used for a second super continent.
The Americas derived their name from the Latin version of Vespucci's first name, Americus.",,,,gpt-4-turbo-3-shot,,,,
724,2504,"Judy Greer was born on July 20, 1975.
Judy Greer's birth name is Judith Therese Evans.
Judy Greer is an American actress.
Judy Greer is a model.
Judy Greer is an author.
Judy Greer played Kitty Sanchez on Arrested Development.
Judy Greer played Ingrid Nelson/Fatty Magoo on It's Always Sunny In Philadelphia.
Judy Greer played Trixie on Californication.
Judy Greer voices Cheryl Tunt on the animated comedy series Archer.",,,,gpt-4-turbo-3-shot,,,,
725,6186,"Mary Tyler Moore underwent brain surgery in May 2011.
Mary Tyler Moore had a benign meningioma removed.
Mary Tyler Moore died at the age of 80.
Mary Tyler Moore died on January 25, 2017.
Mary Tyler Moore's cause of death was cardiopulmonary arrest.
Mary Tyler Moore's cardiopulmonary arrest was due to pneumonia.",,,,gpt-4-turbo-3-shot,,,,
726,2779,"The Constitution of Ireland is based on a system of representative democracy.
The Constitution of Ireland guarantees certain fundamental rights.
The Constitution of Ireland provides for a popularly elected non-executive president.
The Constitution of Ireland establishes a bicameral parliament.
The Constitution of Ireland's parliament is based on the Westminster system.
The Constitution of Ireland includes a separation of powers.
The Constitution of Ireland allows for judicial review.
The Constitution of Ireland is the second constitution of the state since independence.
The Constitution of Ireland replaced the 1922 Constitution of the Irish Free State.",,,,gpt-4-turbo-3-shot,,,,
727,2459,"Tokyo Ghoul is a Japanese film.
Tokyo Ghoul is based on the manga series Tokyo Ghoul by Sui Ishida.
Tokyo Ghoul is a dark fantasy action horror film.
Kentarō Hagiwara directed Tokyo Ghoul.
Masataka Kubota stars as Ken Kaneki in Tokyo Ghoul.
Fumika Shimizu stars as Tōka Kirishima in Tokyo Ghoul.
Tokyo Ghoul is scheduled for release on 29 July 2017.
Shochiku is the distributor of Tokyo Ghoul in Japan.",,,,gpt-4-turbo-3-shot,,,,
728,2612,"Kuching is the capital of the state of Sarawak in Malaysia.
Kuching is the most populous city in the state of Sarawak in Malaysia.
Kuching is officially recognized as a city.
Kuching is the capital of Kuching Division.",1100,1111,0000,gpt-4-turbo-3-shot,356,1100,1111,356
729,5692,"Brazil was a Portuguese colony until 1808.
The capital of the Portuguese empire was moved to Rio de Janeiro in 1808.
Brazil became a kingdom in 1815.
Brazil was part of the United Kingdom of Portugal, Brazil and the Algarves in 1815.
Brazil achieved independence in 1822.
The Empire of Brazil was created in 1822.
The Empire of Brazil was a unitary state.
The Empire of Brazil was governed under a constitutional monarchy.
The Empire of Brazil had a parliamentary system.",,,,gpt-4-turbo-3-shot,,,,
730,1854,"J. J. Abrams directed the Star Wars sequel trilogy.
J. J. Abrams cowrote the screenplay for the Star Wars sequel trilogy.
Lawrence Kasdan cowrote the screenplay for the Star Wars sequel trilogy.
Michael Arndt cowrote the screenplay for the Star Wars sequel trilogy.
Harrison Ford reprised his role in the Star Wars sequel trilogy.
Mark Hamill reprised his role in the Star Wars sequel trilogy.
Carrie Fisher reprised her role in the Star Wars sequel trilogy.
Daisy Ridley co-starred in the Star Wars sequel trilogy.
John Boyega co-starred in the Star Wars sequel trilogy.
Adam Driver co-starred in the Star Wars sequel trilogy.
Oscar Isaac co-starred in the Star Wars sequel trilogy.
The Star Wars sequel trilogy films were planned to be released two years apart.",,,,gpt-4-turbo-3-shot,,,,
731,1996,"Spider-Man was conceived by Lee and Ditko.
Spider-Man is an orphan raised by Aunt May and Uncle Ben.
Spider-Man is a teenager.
Spider-Man deals with normal adolescent struggles.
Spider-Man deals with struggles of a costumed crime-fighter.
Spider-Man has super strength.
Spider-Man has agility.
Spider-Man can cling to most surfaces.
Spider-Man can shoot spider-webs from wrist-mounted devices.
Spider-Man invented his web-shooters.
Spider-Man has a spider-sense.
Spider-Man's spider-sense allows him to react quickly to danger.
Spider-Man appeared in the early 1960s.
Teenagers were usually sidekicks in superhero comic books in the early 1960s.",,,,gpt-4-turbo-3-shot,,,,
732,347,"Winona Ryder acted in the film Heathers.
Heathers is a cult film.
Heathers was released in 1988.
Heathers is a satire of teenage suicide and high school life.
Winona Ryder starred in the film Mermaids.
Mermaids is a coming of age drama.
Winona Ryder received a Golden Globe nomination for Mermaids.
Winona Ryder appeared alongside Johnny Depp in Edward Scissorhands.
Edward Scissorhands was directed by Burton.
Edward Scissorhands is a dark fairy-tale.
Winona Ryder appeared with Keanu Reeves in Bram Stoker's Dracula.
Bram Stoker's Dracula is a gothic romance.
Bram Stoker's Dracula was directed by Francis Ford Coppola.
Winona Ryder won a Golden Globe Award for Best Supporting Actress.
Winona Ryder was nominated for an Academy Award for Best Supporting Actress.
Winona Ryder's award and nomination were for her role in The Age of Innocence.
Winona Ryder received an Academy Award nomination for Best Actress for Little Women.
The Age of Innocence was released in 1993.
Little Women is a literary adaptation.",,,,gpt-4-turbo-3-shot,,,,
733,4547,"Henry's force defeated Richard's army at the Battle of Bosworth Field.
The Battle of Bosworth Field took place in Leicestershire.
Richard III of England died in the Battle of Bosworth Field.
Richard III of England was the last English king to die in battle on home soil.
Richard III of England was the first English king to die in battle since Harold Godwinson.
Harold Godwinson died at the Battle of Hastings in 1066.
Henry VII ascended the throne after the Battle of Bosworth Field.",,,,gpt-4-turbo-3-shot,,,,
734,4479,"Tokyo Ghoul is a Japanese film.
Tokyo Ghoul is an upcoming film.
Tokyo Ghoul is a dark fantasy action horror film.
Tokyo Ghoul is based on a manga series.
The manga series Tokyo Ghoul was created by Sui Ishida.
Kentarō Hagiwara directed Tokyo Ghoul.
Masataka Kubota stars as Ken Kaneki in Tokyo Ghoul.
Fumika Shimizu stars as Tōka Kirishima in Tokyo Ghoul.",,,,gpt-4-turbo-3-shot,,,,
735,2133,"South East England has no elected government.
South East England is a region of England.
South East England is the third largest region of England by area.
South East England has an area of 19,096 square kilometers.
South East England has a population of over eight and a half million as of 2011.
The headquarters for South East England's governmental bodies are in Guildford.
South East England contains seven cities.
Brighton and Hove is a city in South East England.
Canterbury is a city in South East England.
Chichester is a city in South East England.
Oxford is a city in South East England.
Portsmouth is a city in South East England.
Southampton is a city in South East England.
Winchester is a city in South East England.
Reading is a major settlement in South East England.
Milton Keynes is a major settlement in South East England.",,,,gpt-4-turbo-3-shot,,,,
736,3633,"Avril Lavigne took a break from recording music.
Avril Lavigne pursued a career in feature film acting.
Avril Lavigne pursued a career in designing clothes.
Avril Lavigne pursued a career in designing perfumes.
Avril Lavigne voiced a character in the animated film Over the Hedge.
Avril Lavigne voiced Heather, a Virginia opossum.
Avril Lavigne's voice acting in Over the Hedge was in 2006.
Avril Lavigne made her on-screen feature film debut in 2006.
Avril Lavigne's on-screen feature film debut was in Fast Food Nation.",,,,gpt-4-turbo-3-shot,,,,
737,1475,"Otto I reformed the Roman Catholic Church in Germany.
Otto I aimed to strengthen royal authority through church reform.
Otto I brought the German clergy under his personal control.
Otto I quelled a civil war among the duchies.
Otto I defeated the Magyars at the Battle of Lechfeld in 955.
The Battle of Lechfeld ended the Hungarian invasions of Western Europe.
Otto I's victory over the Magyars earned him a reputation as a savior of Christendom.
Otto I's victory at the Battle of Lechfeld secured his control over the kingdom.",00010000,111,00000000,gpt-4-turbo-3-shot,356,00010000,111,356
738,2618,"Marilyn Monroe was born on June 1, 1926.
Marilyn Monroe died on August 5, 1962.
Marilyn Monroe was an American actress.
Marilyn Monroe was a model.
Marilyn Monroe played comic 'dumb blonde' characters.
Marilyn Monroe was a sex symbol of the 1950s.
Marilyn Monroe's films grossed $200 million by 1962.
Marilyn Monroe was a top-billed actress for a decade.
Marilyn Monroe's death was unexpected.",,,,gpt-4-turbo-3-shot,,,,
739,5684,"Brazil is one of 17 megadiverse countries.
Brazil has a unique environmental heritage.
Brazil is the subject of global interest regarding environmental protection.
Brazil is the subject of global debate regarding deforestation.
Brazil was inhabited by numerous tribal nations before 1500.
Pedro Álvares Cabral landed in Brazil in 1500.
Pedro Álvares Cabral claimed Brazil for the Portuguese Empire.
Brazil was a Portuguese colony until 1808.
The capital of the Portuguese Empire was transferred to Rio de Janeiro in 1808.",,,,gpt-4-turbo-3-shot,,,,
740,3712,"Sherlock is a television series.
Sherlock is based on Sherlock Holmes detective stories.
Sherlock Holmes detective stories were written by Sir Arthur Conan Doyle.
Steven Moffat created the TV series Sherlock.
Mark Gatiss created the TV series Sherlock.
Benedict Cumberbatch stars as Sherlock Holmes in the TV series Sherlock.
Martin Freeman stars as Doctor John Watson in the TV series Sherlock.
Sherlock is a crime drama.",,,,gpt-4-turbo-3-shot,,,,
741,1077,"Caitlyn Jenner publicly identified as male before 2015.
Caitlyn Jenner revealed her identity as a trans woman in April 2015.
Caitlyn Jenner changed her name from Bruce to Caitlyn.
Caitlyn Jenner's name change was announced in a Vanity Fair cover story in July 2015.
Caitlyn Jenner's name and gender change became official on September 25, 2015.
Caitlyn Jenner is called the most famous openly transgender woman in the world.",,,,gpt-4-turbo-3-shot,,,,
742,5007,"Aeronautical navigational aids identify in Morse code.
VORs identify in Morse code.
NDBs identify in Morse code.
Morse code is less sensitive to poor signal conditions than voice.
Morse code can be comprehensible to humans without a decoding device.
Morse code is a useful alternative to synthesized speech for sending automated data.
Morse code can be used on voice channels.
Skilled listeners can understand Morse code on voice channels.",,,,gpt-4-turbo-3-shot,,,,
743,2636,"Damon Allen played quarterback in the Canadian Football League for 23 seasons.
Damon Allen was the all-time leader in passing yards in professional football.
Marcus Allen won a Heisman Trophy.
Marcus Allen won an NCAA National Championship.
Marcus Allen won a Super Bowl.
Marcus Allen was named NFL MVP.
Marcus Allen was named Super Bowl MVP.
Marcus Allen is the only player to win a Heisman Trophy, an NCAA National Championship, a Super Bowl, and be named NFL MVP and Super Bowl MVP.
Marcus Allen has been inducted into the College Football Hall of Fame.
Marcus Allen has been inducted into the Pro Football Hall of Fame.",,,,gpt-4-turbo-3-shot,,,,
744,6253,"Top of the Lake is a television series.
Elisabeth Moss plays Detective Robin Griffin in Top of the Lake.
Season 1 of Top of the Lake involves a missing pregnant 12-year-old girl.
The investigation in Season 1 of Top of the Lake takes place in New Zealand.
Season 2 of Top of the Lake is set four years after Season 1.
Season 2 of Top of the Lake is set in Sydney.
Season 2 of Top of the Lake involves the investigation of a dead unidentified Asian girl.
The unidentified Asian girl in Season 2 of Top of the Lake was found at Bondi Beach.
Top of the Lake was co-produced for BBC Two in the UK.
Top of the Lake was co-produced for BBC UKTV in Australia and New Zealand.
Top of the Lake was co-produced for Sundance Channel in the United States.",,,,gpt-4-turbo-3-shot,,,,
745,6490,"Gilmore Girls debuted on October 5, 2000.
Gilmore Girls aired on The WB network.
Gilmore Girls moved to The CW network on September 26, 2006.
Gilmore Girls originally ran for seven seasons.
Gilmore Girls ended on May 15, 2007.
Gilmore Girls is a television series.
Gilmore Girls follows a single mother named Lorelai Gilmore.
Gilmore Girls includes a character named Rory Gilmore.
Gilmore Girls is set in a fictional town called Stars Hollow, Connecticut.",,,,gpt-4-turbo-3-shot,,,,
746,3032,"The supporting cast of BoJack Horseman includes Amy Sedaris.
The supporting cast of BoJack Horseman includes Alison Brie.
The supporting cast of BoJack Horseman includes Paul F. Tompkins.
The supporting cast of BoJack Horseman includes Aaron Paul.
BoJack Horseman's first season premiered on August 22, 2014.
BoJack Horseman's first season premiered on Netflix.
BoJack Horseman had a Christmas special that premiered on December 19.
Lisa Hanawalt designed BoJack Horseman.
Lisa Hanawalt previously worked with Bob-Waksberg on the webcomic Tip Me Over, Pour Me Out.",,,,gpt-4-turbo-3-shot,,,,
747,3213,"Sherlock has been sold to 180 territories.
Sherlock series have been released on DVD.
Sherlock series have been released on Blu-ray.
Tie-in editions of selected original Conan Doyle stories have been released.
An original soundtrack for Sherlock was composed by David Arnold.
An original soundtrack for Sherlock was composed by Michael Price.
Sherlock launched an official mobile app in January 2014.
The official mobile app of Sherlock is called Sherlock: The Network.",,,,gpt-4-turbo-3-shot,,,,
748,1202,"""Beautiful"" received universal acclaim from music critics.
""Beautiful"" is considered one of Christina Aguilera's strongest songs.
""Beautiful"" won a Grammy Award for Best Female Pop Vocal Performance.
""Beautiful"" was nominated for Song of the Year at the 2004 Grammy Awards.
""Beautiful"" topped the charts in Australia.
""Beautiful"" topped the charts in Belgium.
""Beautiful"" topped the charts in Canada.
""Beautiful"" topped the charts in Ireland.
""Beautiful"" topped the charts in New Zealand.
""Beautiful"" topped the charts in the United Kingdom.",,,,gpt-4-turbo-3-shot,,,,
749,2280,"L.A. Reid was born on June 7, 1956.
L.A. Reid is an American music executive.
L.A. Reid is a musician.
L.A. Reid is a songwriter.
L.A. Reid is a record producer.
L.A. Reid is an author.
L.A. Reid was a television music competition judge.
L.A. Reid served as chairman and CEO of Epic Records.
Epic Records is a division of Sony Music Entertainment.
L.A. Reid was president and CEO of Arista Records.
L.A. Reid was chairman and CEO of the Island Def Jam Music Group.
L.A. Reid founded Hitco Music Publishing.
L.A. Reid was CEO of Hitco Music Publishing.
L.A. Reid co-founded LaFace Records.",,,,gpt-4-turbo-3-shot,,,,
750,2039,"Atomic Blonde is a film released in 2017.
Atomic Blonde is an American action spy thriller film.
David Leitch directed Atomic Blonde.
Kurt Johnstad wrote Atomic Blonde.
Atomic Blonde is based on the graphic novel The Coldest City.
The Coldest City was published in 2012.
Antony Johnston and Sam Hart created The Coldest City.
Atomic Blonde's plot involves a spy finding a list of double agents.
Charlize Theron starred in Atomic Blonde.
James McAvoy starred in Atomic Blonde.
John Goodman starred in Atomic Blonde.
Til Schweiger starred in Atomic Blonde.
Eddie Marsan starred in Atomic Blonde.
Sofia Boutella starred in Atomic Blonde.
Toby Jones starred in Atomic Blonde.",,,,gpt-4-turbo-3-shot,,,,
751,4120,"R. Kelly released a solo album called 12 Play in 1993.
R. Kelly is known for the single 'Bump N' Grind'.
R. Kelly is known for the single 'Your Body's Callin''.
R. Kelly is known for the single 'I Believe I Can Fly'.
R. Kelly is known for the single 'Gotham City'.
R. Kelly is known for the single 'Ignition (Remix)'.
R. Kelly is known for the single 'If I Could Turn Back the Hands of Time'.
R. Kelly is known for the single 'The World's Greatest'.
R. Kelly is known for the single 'I'm a Flirt (Remix)'.
R. Kelly created the hip-hopera 'Trapped in the Closet'.
R. Kelly won three Grammy Awards for 'I Believe I Can Fly' in 1998.",,,,gpt-4-turbo-3-shot,,,,
752,2767,"Seth Rogen co-wrote the film Superbad.
Seth Rogen co-wrote the film Pineapple Express.
Seth Rogen co-wrote the film The Green Hornet.
Seth Rogen co-wrote the film This Is the End.
Seth Rogen co-directed the film This Is the End.
Seth Rogen co-directed the film The Interview.
Seth Rogen starred in the film Superbad.
Seth Rogen starred in the film Pineapple Express.
Seth Rogen starred in the film The Green Hornet.
Seth Rogen starred in the film This Is the End.
Seth Rogen starred in the film The Interview.
Seth Rogen has done voice work for the film Horton Hears a Who!.
Seth Rogen has done voice work for the Kung Fu Panda film series.
Seth Rogen has done voice work for The Spiderwick Chronicles.
Seth Rogen has done voice work for Monsters vs. Aliens.
Seth Rogen has done voice work for the film Paul.
Seth Rogen has done voice work for Sausage Party.",,,,gpt-4-turbo-3-shot,,,,
753,3362,"James A. Woods trained at the Lee Strasberg Theatre and Film Institute.
James A. Woods is an actor.
James A. Woods returned to Montreal to pursue acting.
James A. Woods starred in Hatley High.
Hatley High was distributed in Canada by Seville Films.
Hatley High won Best Director at The Comedy Festival.
Hatley High won Best Screenplay at The Comedy Festival.
James A. Woods' film credits include Eternal.
Eternal was released by TVA Films.
James A. Woods appeared in the film Levity.
Levity was directed by Ed Solomon.",,,,gpt-4-turbo-3-shot,,,,
754,6134,"Magic Johnson is a retired professional basketball player.
Magic Johnson was born on August 14, 1959.
Magic Johnson is the current president of basketball operations for the Los Angeles Lakers.
Magic Johnson played in the NBA.
Magic Johnson played for the Los Angeles Lakers for 13 seasons.
Magic Johnson played as a point guard.
Magic Johnson won championships in high school.
Magic Johnson won a championship in college.
Magic Johnson was selected first overall in the 1979 NBA draft.",,,,gpt-4-turbo-3-shot,,,,
755,1927,"Methadone may be used to treat heroin addiction.
Naltrexone may be used to treat heroin addiction.
Naloxone may be used to treat a heroin overdose.
An estimated 17 million people used opiates such as heroin as of 2015.
Opiates and opioids resulted in 122,000 deaths in 2015.",,,,gpt-4-turbo-3-shot,,,,
