id,acl_sentence,claim,annotation,user,cross_annotations,cross_users
2836,5254,"Sports Illustrated called Agassi a ``Career Super Slam"".",,,,
2837,5254,Agassi won four Grand Slam tournaments.,,,,
2839,5254,Agassi won the Davis Cup in 1992.,,,,
2841,5254,Agassi won three different surfaces.,,,,
2842,1913,Daniela Hantuchová beat Laura Robson in the Aegon Classic.,,,,
2843,1913,Daniela Hantuchová reached the semifinals of the Australian Open in 2008.,,,,
2844,1913,Daniela Hantuchová reached 500 career wins in the Open Era.,,,,
2845,1913,Daniela Hantuchová has reached 37th in career wins.,,,,
2846,1913,Daniela Hantuchová is the most successful Slovak tennis player of all time.,,,,
2848,1913,Daniela Hantuchová beat Laura Robson in the second round of the Aegon Classic.,,,,
2850,1913,Daniela Hantuchová has 500 career wins.,,,,
2851,1913,Daniela Hantuchová beat Laura Robson in the second round of the Aegon Classic in June 2013.,,,,
2852,1913,Daniela Hantuchová has progressed to a Grand Slam since reaching the semifinals of the Australian Open.,,,,
2853,1913,Hantuchová is an accomplished doubles player.,,,,
2854,1913,Daniela Hantuchová is Slovak.,,,,
2855,172,"Cara's single ""Scars to Your Beautiful"" was on the Billboard Hot 100 at number ten.",,,,
2856,172,"Cara's third top ten single was ""Scars to Your Beautiful"".",,,,
2857,172,"Cara's single ""Scars to Your Beautiful"" reached the top ten on the Billboard Hot 100.",,,,
2858,172,Cara collaborated with producer Zedd to create the album Stay in 2017.,,,,
2859,172,"Cara ranked third on the Billboard Hot 100 chart for her single ""Stay"".",,,,
2860,172,"Cara's single ""Scars to Your Beautiful"" reached the top ten on the Billboard Hot 100 in 2016.",,,,
2861,172,"Cara's single ""Stay"" reached number 7 on the Billboard Hot 100.",,,,
2863,172,"The name of Cara's third top ten single was ""Stay"".",,,,
2864,172,"Cara's single ""Scars to Your Beautiful"" topped the pop radio charts in the US.",,,,
2865,172,"Zedd produced the single ""Stay"".",,,,
2866,172,The name of Cara's third top ten song is Alessia Cara.,,,,
2867,172,The name of Alessia's third top ten song is Cara.,,,,
2868,1202,Beautiful topped the charts in Australia.,,,,
2869,1202,"Along with Canada, Ireland, New Zealand, and the United Kingdom, Beautiful topped the charts in Belgium.",,,,
2870,1202,"Along with Australia, Canada, Ireland, New Zealand and the United States, the United Kingdom also had the top spot on the charts.",,,,
2871,1202,Beautiful won a Grammy Award for Best Female Pop Vocal Performance.,,,,
2872,1202,Beautiful was nominated for Song of the Year in 2004.,,,,
2873,1202,Beautiful was nominated for Song of the Year at the 2004 Grammy Awards.,,,,
2874,1202,Aguilera wrote the song Beautiful.,,,,
2875,1202,"Along with Australia, Canada, Ireland, and the United Kingdom, New Zealand had a commercial success with ""Beautiful"".",,,,
2876,1202,Beautiful topped the charts in Canada.,,,,
2877,1202,Beautiful topped the charts in Ireland.,,,,
2878,1202,Christina Aguilera wrote the song Beautiful.,,,,
2879,1202,Beautiful was the name of Christina Aguilera's song.,,,,
2880,1202,Beautiful won the Grammy award for Best Female Pop Vocal Performance.,,,,
2881,295,Nixon was impeached by the House of Representatives.,,,,
2882,295,The House of Representatives impeached Andrew Johnson and Bill Clinton.,,,,
2883,295,Richard Nixon was impeached by the House of Representatives.,,,,
2884,295,"To date, no president has been removed from office by impeachment and conviction.",,,,
2885,295,Andrew Johnson and Bill Clinton are the only two presidents to have been impeached by the House of Representatives.,,,,
2886,295,Andrew Johnson and Bill Clinton have been impeached in the United States.,,,,
2887,295,Bill Clinton was the only president to be impeached by the House of Representatives.,,,,
2888,295,Two presidents have been impeached by the House of Representatives.,,,,
2889,295,The Senate acquitted Andrew Johnson and Bill Clinton.,,,,
2890,295,Andrew Johnson was the only president to be impeached by the House of Representatives.,,,,
2891,341,Robertson won the MVP award after 14 professional seasons.,,,,
2892,341,Robertson won the MVP award one time.,,,,
2893,341,Oscar Robertson was a member of the National Basketball Association.,,,,
2894,341,Oscar Palmer Robertson played for the Cincinnati Royals.,,,,
2895,341,The award that Robertson won in 14 professional seasons was MVP.,,,,
2896,341,Oscar Robertson was American.,,,,
2897,341,Robertson was an All-Star 12 times.,,,,
2898,341,Oscar Robertson was 6 ft tall.,,,,
2899,341,Robertson won the All-Star award 12 times.,,,,
2900,341,"Along with the Cincinnati Royals, Oscar Robertson played for the Milwaukee Bucks.",,,,
2901,341,Robertson was a member of the All-NBA team 11 times.,,,,
2902,341,The real name of Oscar Robertson was Oscar Palmer Robertson.,,,,
2903,341,Oscar Robertson was 205 lb.,,,,
2904,341,The nickname of Oscar Palmer Robertson was Robertson.,,,,
2905,341,The nickname of Oscar Palmer Robertson is Oscar Robertson.,,,,
2906,341,"Oscar Robertson was born on November 24, 1938.",,,,
2907,341,"Oscar Robertson was nicknamed ""The Big O"".",,,,
2908,341,Oscar Robertson was a member of the All-NBA Team.,,,,
2909,4223,The UK is considered to have a high-income economy.,,,,
2910,4223,The UK is ranked very high in the Human Development Index.,,,,
2911,4223,The United Kingdom is considered to have a high-income economy.,,,,
2912,4223,The UK was the world's foremost power during the 19th and early 20th centuries.,,,,
2913,4223,The UK ranks 16th in the Human Development Index.,,,,
2914,4223,The world's first industrialised country was first.,,,,
2915,5213,Moffat has been executive producer of the tenth season of Doctor Who.,,,,
2916,5213,The final season of Doctor Who is third.,,,,
2917,5213,Peter Capaldi is the Twelfth Doctor.,,,,
2918,5213,The third and final series overseen by the two as executive producers is Doctor Who.,,,,
2919,5213,Moffat is the head writer for the sixth season of Doctor Who.,,,,
2920,5213,The return of Doctor Mysterio was at Christmas.,,,,
2921,5213,Capaldi portrayed the Twelfth Doctor.,,,,
2922,5213,The Twelfth Doctor is a Time Lord.,,,,
2923,5213,"The title of the Christmas special was ""The Return of Doctor Mysterio"".",,,,
2924,5213,A Christmas special aired on Doctor Who in December 2016.,,,,
2925,5213,The third and final season of Doctor Who is 10.,,,,
2926,5213,Two executive producers oversee Doctor Who.,,,,
2927,5213,Moffat's final season of Doctor Who is the sixth season.,,,,
2928,5213,The third and final series of Doctor Who is Doctor.,,,,
2929,5213,The name of Capaldi's vehicle is TARDIS.,,,,
2930,5213,The TARDIS appears to be British.,,,,
2931,5213,Peter Capaldi announced he would be stepping down as the Twelfth Doctor in January 2017.,,,,
2932,5213,Doctor Who relaunched in 2005.,,,,
2933,5213,Doctor Who has a thirty-sixth season.,,,,
2934,5213,Peter Capaldi is the Twelfth Doctor in Doctor Who.,,,,
2935,779,The third most populous city in California is San Jose.,,,,
2936,779,San Jose is located in California.,,,,
2937,779,San Jose is the tenth most populous city in the United States.,,,,
2938,779,The official name of San Jose is the City of San José.,,,,
2939,779,San Jose is located on the southern shore of San Francisco Bay.,,,,
2940,779,San Jose ranks tenth among the most populous cities in the United States.,,,,
2941,779,"The estimated population of San Jose in 2015 is 1,026,908.",,,,
2942,779,San Jose ranks third among the most populous cities in California.,,,,
2943,779,"Along with San Diego, San Jose is the third most populous city in California.",,,,
2944,779,"San Jose is the economic, cultural, and political center of Silicon Valley.",,,,
2945,779,San Jose is located in Northern California.,,,,
2946,779,San Jose is 179.97 square miles.,,,,
2947,779,San Jose is 466.109 km2.,,,,
2948,779,San Jose is located in the Santa Clara Valley.,,,,
2949,779,"San Jose had an estimated population of 1,026,908 in 2015.",,,,
2950,779,San Jose comes from the Spanish language.,,,,
2951,779,"Along with Los Angeles, San Jose is the third most populous city in California, after San Diego.",,,,
2952,1007,The name of the science fiction show starring James McAvoy was Children of Dune.,,,,
2953,1007,James McAvoy won the Laurence Olivier Award for best Actor.,,,,
2954,1007,McAvoy has been a part of the television show West End.,,,,
2955,1007,James McAvoy began his acting career in 1995.,,,,
2956,1007,The name of McAvoy's drama show is State of Play.,,,,
2957,1007,James McAvoy's first acting role was The Near Room.,,,,
2958,1007,The name of McAvoy's adult comedy-drama is Shameless.,,,,
2959,1007,James McAvoy received the Laurence Olivier Award for Best Actor.,,,,
2960,1007,James McAvoy made his acting debut as a teen.,,,,
2961,1007,James McAvoy starred in the science fiction show Frank Herbert's.,,,,
2962,1007,McAvoy began his film career in 2003.,,,,
2963,1007,James McAvoy's real name is McAvoys.,,,,
2964,1007,McAvoy received three nominations for the Laurence Olivier Award for Best Actor.,,,,
2965,5261,The main economic council of wealthy nations is G20.,,,,
2966,5261,EU is the group represented by the European Commission and the European Central Bank.,,,,
2967,5261,The G20 accounts for 75 % of world trade excluding EU intra-trade.,,,,
2968,5261,The European Commission represents the EU in the G20.,,,,
2969,5261,The G20 accounts for two-thirds of the world population.,,,,
2970,5261,The European Central Bank represents the EU in the G20.,,,,
2971,5261,The G20 economies account for 80 % of world trade.,,,,
2972,5261,The G20 summit took place in 2008.,,,,
2973,5261,The G20 leaders announced that they would replace the G8 as the main economic council of wealthy nations on 25 September 2009.,,,,
2974,5261,The G20 replaced G8 as the main economic council of wealthy nations.,,,,
2975,5261,The G20 economies account for around 85 % of the world's GDP collectively.,,,,
2976,1927,17 million people used heroin in 2015.,,,,
2977,1927,An estimated 17 million people use heroin as of 2015.,,,,
2978,1927,"122,000 deaths were caused by heroin and opioids in 2015.",,,,
2979,4586,Heroin is an opiate most commonly used as a recreational drug for its euphoric effects.,,,,
2980,2707,BoxRec ranked Floyd Mayweather as the number one fighter of all time.,,,,
2981,2707,Yahoo ranked Floyd Mayweather as the best boxer in the world.,,,,
2982,2707,BoxRec ranked Floyd Mayweather Jr. as one of the greatest fighters of all time.,,,,
2983,2707,Floyd Mayweather Jr. is the most accurate puncher since the existence of CompuBox.,,,,
2984,2707,Fox Sports ranked Floyd Mayweather Jr. as the best boxer in the world.,,,,
2985,2707,Floyd Mayweather Jr. is regarded as the best boxer in the world.,,,,
2986,2707,The Ring magazine ranked Floyd Mayweather as the best boxer in the world.,,,,
2987,2707,Sports Illustrated ranked Floyd Mayweather as the best boxer in the world.,,,,
2988,2707,Mayon is regarded as the best boxer in the world.,,,,
2989,2707,Floyd Mayweather Jr. peaked as BoxRec's number one fighter of all time in the same year.,,,,
2990,2707,Floyd Mayweather has been ranked as the best boxer in the world for ten years.,,,,
2991,2707,ESPN ranked Floyd Mayweather as the best boxer in the world.,,,,
2992,6140,"R. Kelly was nominated for a Grammy for writing Michael Jackson's song ""You Are Not Alone"".",,,,
2993,6140,"Kelly was nominated for a Grammy for writing Michael Jackson's song ""You Are Not Alone"".",,,,
2994,6140,R. Kelly is one of the best-selling music artists in the United States.,,,,
2995,6140,"Kelly was nominated for a Grammy in 1996 for the Michael Jackson song ""You Are Not Alone"".",,,,
2996,6140,The number of albums sold by R. Kelly is 50.,,,,
2997,6140,Kelly has been the most successful R&B artist for the last 25 years.,,,,
2998,6140,"Kelly received Grammy awards for writing Michael Jackson's song ""You Are Not Alone"".",,,,
2999,6140,"Along with Nas, Nas, and The Notorious B.I.G, Sean Combs was a guest vocalist for Kelly.",,,,
3000,6140,Billboard named Kelly the most successful R&B artist of the last 25 years.,,,,
3001,6140,"Along with Nas, Sean Combs and Nas, Kelly has been a guest vocalist for The Notorious B.I.G.",,,,
3002,6140,Kelly was nominated for a Grammy one time.,,,,
3003,6140,Kelly collaborated with Jay-Z in 2002 and 2004.,,,,
3004,6140,Kelly collaborated with Jay-Z in 2004.,,,,
3005,6140,"Along with Sean Combs and The Notorious B.I.G, Kelly has been a guest vocalist for Nas.",,,,
3006,6140,Kelly collaborated with Jay-Z in 2002.,,,,
3007,6140,The Recording Industry Association of America recognized R. Kelly as one of the best-selling music artists in the US.,,,,
3008,6140,The acronym for the Recording Industry Association of America is RIAA.,,,,
3009,6140,Kelly was nominated for a Grammy for Michael Jackson's in 1996.,,,,
3010,6140,Kelly was nominated for a Grammy in 1996.,,,,
3011,6140,Kelly has sold 40 million albums.,,,,
3012,6140,R. Kelly was named the most successful R&B artist of the last 25 years by Billboard in March 2011.,,,,
3013,6140,Kelly has been the most successful in the R&B genre in the last 25 years.,,,,
3014,6140,Kelly ranked fifth on the RIAA's top 50 black artists list.,,,,
3015,5954,One copy of Under My Skin has been sold worldwide.,,,,
3016,5954,The title of Lavigne's second album was Let Go.,,,,
3017,5954,Avril Lavigne's third album has been sold 20 million copies worldwide.,,,,
3018,5954,Under My Skin was Lavigne's first album to peak at number 1 on the US Billboard 200 chart.,,,,
3019,5954,Under My Skin sold more than 12 million copies worldwide.,,,,
3020,5954,Avril Lavigne released her second album in the United States.,,,,
3021,5954,Lavigne's second album was called Under My Skin.,,,,
3022,5954,Under My Skin was released in May 2004.,,,,
3023,5954,Avril Lavigne released her second album in 2013.,,,,
3024,5954,Lavigne's second album was his second album.,,,,
3025,5954,Nearly 7 million copies of Under My Skin have been sold in the United States.,,,,
3026,5954,"Avril Lavigne's breakthrough single was ""Complicated"".",,,,
3027,5954,The title of Avril Lavigne's second album was first.,,,,
3028,5954,Avril Lavigne released Under My Skin.,,,,
3029,6494,The name of the duo's first album was I Love You but I Must Drive Off This Cliff Now.,,,,
3030,6494,Got a Girl is American.,,,,
3031,6494,Got a Girl's first album was released in 2014.,,,,
3032,6494,The name of the duo that got a girl is a Girl.,,,,
3033,6494,The name of the actress in Got a Girl is Mary Elizabeth Winstead.,,,,
3034,6494,Got a Girl formed in 2012.,,,,
3035,6494,The name of the duo's first album was first.,,,,
3036,6494,Dan the Automator is the producer of Got a Girl.,,,,
3037,5801,Agassi won the Davis Cup in 1995.,3311,360,3311,360
3038,5801,Agassi won 17 ATP Masters Series titles.,3311,360,3311,360
3039,5801,Agassi returned to the top of the world rankings in 1999.,3311,360,3311,360
3040,5801,Agassi won the Davis Cup in 1992.,3311,360,3311,360
3041,5801,Agassi dropped to World No. 141 in 1997.,3311,360,3311,360
3042,5801,"Agassi was a part of winning the Davis Cup in 1990, 1992 and 1995.",3111,360,3111,360
3043,5801,The name of Agassi's career was World No. 141.,1101,360,1101,360
3044,5801,Agassi was career was troubled during the mid-to-late 1990s.,3211,360,3211,360
3045,5801,The name of Agassi's career was World No. 1.,1101,360,1101,360
3046,5801,Agassi won the Davis Cup in 1990.,3311,360,3311,360
3047,5801,Agassi enjoyed the most successful run of his career for the next four years.,3301,360,3301,360
3048,5801,Andre Agassi won 17 ATP Masters Series titles.,3311,360,3311,360
3050,5801,Agassi competed in the ATP Masters Series.,3311,360,3311,360
3051,5801,Agassi reached the World No. 1 ranking first.,3301,360,3301,360
3052,5801,Agassi won 1 title of ATP Masters Series titles.,1311,360,1311,360
3053,4547,Richard defeated Henry's army at the Battle of Bosworth Field.,,,,
3054,4547,Henry defeated Richard's army at the Battle of Bosworth Field.,,,,
3055,4547,Henry's first name on the throne was Henry VII.,,,,
3056,4547,Henry's army defeated Richard's Army at the Battle of Bosworth Field.,,,,
3057,4547,Harold Godwinson was killed at the Battle of Hastings.,,,,
3058,4547,Richard III defeated Henry's army at the Battle of Bosworth Field.,,,,
3059,4547,Richard III was from England.,,,,
3060,4547,The Battle of Bosworth Field was in Leicestershire.,,,,
3061,4547,Harold Godwinson was the first English king to die in battle on home soil.,,,,
3062,4547,Harold Godwinson was killed in 1066.,,,,
3063,4547,The first time a king died in a battle on home soil was first.,,,,
3064,4547,The last king to die in battle on home soil was English.,,,,
3065,4746,"The Weeknd was born on February 16, 1990.",,,,
3066,4746,The Weeknd first uploaded songs to YouTube.,,,,
3067,4746,The birth name of The Weeknd was Abel Makkonen Tesfaye.,,,,
3068,4746,The Weeknd first gained recognition in late 2010.,,,,
3069,4746,The Weeknd is Canadian.,,,,
3070,4746,The nickname of The Weeknd is Weeknd.,,,,
3071,4746,The nickname of The Weeknd is The Weekrd.,,,,
3072,6316,Anne Bancroft won two Golden Globes.,,,,
3073,6316,Anne Bancroft reprises her role in Broadway.,,,,
3074,6316,Anne Bancroft won the Golden Globes.,,,,
3075,6316,"Anne Bancroft was recognized for her work in film, theatre and television.",,,,
3076,6316,Anne Bancroft had a string of supporting roles during the 1950s.,,,,
3077,6316,Anne Bancroft won an Academy Award for Best Actress for her role in The Miracle Worker.,,,,
3078,6316,Helen Keller was the teacher in The Miracle Worker.,,,,
3079,6316,Anne Bancroft won one Academy Award.,,,,
3080,6316,Anne Bancroft won the Tony Awards.,,,,
3081,6316,The name of Anne Bancroft's role as Helen Keller was The Miracle Worker.,,,,
3082,6316,Anne Bancroft won the BAFTA Awards.,,,,
3083,6316,The Miracle Worker was released in 1962.,,,,
3084,6316,Anne Bancroft's film debut was Don't Bother to Knock (1952).,,,,
3085,6316,Anne Bancroft won Emmy Awards.,,,,
3086,6316,Anne Bancroft was a nurse.,,,,
3087,6316,Anne Bancroft won three BAFTA Awards.,,,,
3088,119,Another name for the Ultimate Fighting Championship is the UFC.,,,,
3089,119,Brock's first name was Lesnar.,,,,
3090,119,Brock Lesnar was the UFC Heavyweight Champion in 2008.,,,,
3091,119,Brock Lesnar fought Frank Mir in his UFC debut.,,,,
3092,119,Brock Lesnar became the UFC Heavyweight Champion in November 2008.,,,,
3093,119,Brock Lesnar signed with the UFC in the following October.,,,,
3094,119,Brock Lesnar signed with the Ultimate Fighting Championship.,,,,
3095,119,Brock Lesnar won the second fight against Heath Herring.,,,,
3096,119,Brock Lesnar fought Heath Herring in his second fight.,,,,
3097,119,Brock Lesnar defeated Randy Couture to become the UFC Heavyweight Champion.,,,,
3098,5041,"Kiss Land sold 273,000 copies in the United States.",,,,
3099,5041,"Kiss Land sold over 273,000 copies in the United States.",,,,
3100,5041,The name of the rapper who released his third mixtape is Weeknd.,,,,
3101,5041,Kiss Land debuted at number two on the Billboard 200.,,,,
3102,5041,Kiss Land debuted at number two on the Billboard 200 chart.,,,,
3103,5041,The Weeknd released Kiss Land in 2013.,,,,
3104,5041,The name of The Weeknd's compilation album was Trilogy.,,,,
3105,5041,The Weeknd had three mixtapes.,,,,
3106,5041,The name of The Weeknd's debut album was Kiss Land.,,,,
3107,1705,The name of the sequel trilogy is Star Wars.,,,,
3108,1705,The sequel films are planned to be released two years apart.,,,,
3109,1705,Derek Connolly wrote the script for Episode IX.,,,,
3110,1705,Trevorrow directed Episode IX of the Star Wars: The Last Jedi.,,,,
3111,1705,The name of the first Star Wars film is The Last Jedi.,,,,
3112,1705,Rian Johnson is the screenwriter and director of Star Wars: The Last Jedi.,,,,
3113,1705,"Episode IX is scheduled to be released on May 24, 2019.",,,,
3114,1705,"The Last Jedi is set to be released on December 15, 2017.",,,,
3115,1705,Two films were released in the previous trilogy.,,,,
3116,1705,Colin Trevorrow directed Episode IX of the Star Wars: The Last Jedi.,,,,
3117,1705,The previous two films were released approximately three years apart.,,,,
3118,1705,The name of the next Star Wars film is Episode IX.,,,,
3119,2950,The title track of The Weeknd's 2016 album was third.,,,,
3120,2950,The Weeknd's third number one single was one.,,,,
3121,2950,The Weeknd's third number-one single landed in the U.S.,,,,
3122,2950,The Weeknd won two Grammy Awards in 2016 at 58th.,,,,
3123,2950,The Weeknd won the 58th Grammy Awards in 2016.,,,,
3124,2950,The Weeknd's third number one single landed in the UK.,,,,
3125,2950,The name of The Weeknd's third number one single is Weeknd.,,,,
3126,2950,"Starboy topped the chart in the U.S., UK, and Canada.",,,,
3127,2950,The Weeknd won the annual Grammy Awards in 2016.,,,,
3128,2950,"The name of The Weeknd's third album was Starboy, in 2016.",,,,
3129,2950,The Weeknd's third number one single was The WeekndHe.,,,,
3130,1141,Winona Ryder was Winona Ryder.,,,,
3131,1141,Winona Ryder reunited with Burton for Frankenweenie.,,,,
3132,1141,Winona Ryder appeared in Star Trek after a brief hiatus.,,,,
3133,1141,Winona Ryder returned to the screen in 2006.,,,,
3134,1141,Winona Ryder was a part of Black Swan.,,,,
3135,1141,Winona Ryder reunited with Burton for the film Frankenweenie.,,,,
3136,1141,Winona Ryder won two Screen Actors Guild Awards in 2010.,,,,
3137,1141,Winona Ryder was the lead actress in Black Swan.,,,,
3138,1141,Winona Ryder won the Screen Actors Guild Awards in 2010.,,,,
3139,1141,Frankenweenie was released in 2012.,,,,
3140,1141,Winona Ryder was the lead actress in When Love Is Not Enough: The Lois Wilson Story.,,,,
3141,1141,Winona Ryder was nominated for two Screen Actors Guild Awards in 2010.,,,,
3142,3058,The Minnesota Vikings compete in the NFC North division.,,,,
3143,3058,The Minnesota Vikings compete in the National Football Conference.,,,,
3144,3058,Vikings compete in the NFC North division.,,,,
3145,3058,U.S. Bank Stadium is located in Downtown East.,,,,
3146,3058,The Minnesota Vikings competed in the NFL's Western Conference Central Division before the NFC Central.,,,,
3147,3058,Another name for the National Football Conference is NFC.,,,,
3148,3058,The Minnesota Vikings play their home games at U.S. Bank Stadium.,,,,
3149,3058,The Minnesota Vikings competed in the NFC Central division before the NFC North division.,,,,
3150,3058,The Minnesota Vikings have played in Super Bowls.,,,,
3151,3058,U.S. Bank Stadium is located in Minneapolis.,,,,
3152,3058,The Minnesota Vikings have played four Super Bowl games.,,,,
3153,2647,Vanessa Williams received a supporting actress award in 2007.,,,,
3154,2647,Vanessa Williams received an Emmy nomination for her portrayal of Ugly Betty in 59th.,,,,
3155,2647,Wilhelmina Slater is a fictional character in the American dramedy series Ugly Betty.,,,,
3156,2647,Wilhelmina Vivian Slater's birth name was Wanda Slater.,,,,
3157,2647,Vanessa Williams received an Emmy nomination for her portrayal of Ugly Betty in 60th.,,,,
3158,2647,The nationality of Ugly Betty is American.,,,,
3159,2647,Vanessa Williams plays Wilhelmina Slater.,,,,
3160,2647,Vanessa Williams received Primetime Emmy Awards for her portrayal of Ugly Betty.,,,,
3161,2647,Vanessa Williams received a supporting actress award in 2008.,,,,
3162,2647,Vanessa Williams received the Best TV Villain award at the 2007 Teen Choice Awards.,,,,
3163,2647,Vanessa Williams received a Best TV Villain award at the Teen Choice Awards.,,,,
3164,2647,Vanessa Williams received the 61st primetime Emmy nomination for her portrayal of Ugly Betty.,,,,
3165,2647,Wilhelmina Slater is the name of the fictional character in Ugly Betty.,,,,
3166,2647,Vanessa Williams received the NAACP Image Awards for her role as Ugly Betty.,,,,
3167,2647,Vivian Slater is the real name of the fictional character in Ugly Betty.,,,,
3168,669,Three songs from Led Zeppelin IV were included on Physical Graffiti.,,,,
3169,669,One outtakes from Led Zeppelin III were included on Physical Graffiti.,,,,
3170,669,Led Zeppelin wrote and recorded eight new songs for their sixth album at Headley Grange.,,,,
3171,669,Led Zeppelin released the sixth studio album of Physical Graffiti.,,,,
3172,669,The typical length of a single Led Zeppelin album is LP.,,,,
3173,669,Led Zeppelin included three tracks from Led Zeppelin IV album.,,,,
3174,669,Physical Graffiti was released as a double album on 24 February 1975.,,,,
3175,669,Led Zeppelin's new record label was Swan Song Records.,,,,
3176,669,Physical Graffiti is the name of the sixth studio album by Led Zeppelin.,,,,
3177,669,Led Zeppelin's sixth album was released as a double album on the Physical Graffiti label.,,,,
3178,669,Led Zeppelin released six studio albums.,,,,
3179,669,Led Zeppelin wrote and recorded eight songs for their sixth album.,,,,
3180,669,Led Zeppelin included one outtake from the album Led Zeppelin III.,,,,
3181,669,Led Zeppelin is English.,,,,
3182,669,Led Zeppelin included three tracks from the album Houses of the Holy.,,,,
3183,2903,The name of the film that was shot in California was Hulk.,,,,
3184,2903,Hulk was mostly shot in California.,,,,
3186,2903,The budget for Hulk was $ 137 million.,,,,
3187,2903,Danny Elfman composed the music for Hulk.,,,,
3188,2903,Hulk grossed over $ 245 million worldwide.,,,,
3189,2903,Hulk was shot primarily in the San Francisco Bay Area.,,,,
3190,2903,Some critics criticized CGI about Hulk's dark story elements.,,,,
