id,acl_sentence,claim,annotation,user,cross_annotations,cross_users
6122,343,Roger Moore played James Bond.,,,,
6123,343,Roger Moore starred in seven James Bond films.,,,,
6124,343,Roger Moore's James Bond films were released between 1973 and 1985.,,,,
6125,795,Emily Dickinson's work was often altered by publishers during her lifetime.,,,,
6126,795,Emily Dickinson's published work was modified to fit conventional poetic rules of her time.,,,,
6127,795,Emily Dickinson's poems are considered unique for her era.,,,,
6128,795,Emily Dickinson's poems often lack titles.,,,,
6129,795,Emily Dickinson's poems frequently use short lines.,,,,
6130,795,Emily Dickinson's poems commonly employ slant rhyme.,,,,
6131,795,Emily Dickinson's poems use unconventional capitalization.,,,,
6132,795,Emily Dickinson's poems use unconventional punctuation.,,,,
6133,795,Emily Dickinson's poems frequently address the theme of death.,,,,
6134,795,Emily Dickinson's poems often explore the theme of immortality.,,,,
6135,795,Emily Dickinson discussed death and immortality in letters to her friends.,,,,
6136,5957,American Gods has a television adaptation.,,,,
6137,5957,The television adaptation of American Gods began airing in April 2017.,,,,
6138,5957,Starz is the network that airs the television adaptation of American Gods.,,,,
6139,5957,Bryan Fuller is a showrunner for the American Gods television adaptation.,,,,
6140,5957,Michael Green is a showrunner for the American Gods television adaptation.,,,,
6141,5957,Neil Gaiman is an executive producer for the American Gods television adaptation.,,,,
6142,5536,Prisoner is an Australian soap opera.,,,,
6143,5536,Prisoner is set in a fictional women's prison.,,,,
6144,5536,The fictional women's prison in Prisoner is named Wentworth Detention Centre.,,,,
6145,5536,Prisoner was known as Prisoner: Cell Block H in the United States.,,,,
6147,5536,Prisoner was known as Caged Women in Canada.,,,,
6148,1150,The Voice is a U.S. TV series.,,,,
6149,1150,"NBC renewed The Voice through its thirteenth season on October 18, 2016.",,,,
6151,1150,Jennifer Hudson was announced as a new coach for The Voice's thirteenth season.,,,,
6152,1150,Kelly Clarkson was announced as a new coach for The Voice's fourteenth season.,,,,
6153,1150,Adam Levine was a coach on The Voice's fourteenth season.,,,,
6154,1150,Blake Shelton was a coach on The Voice's fourteenth season.,,,,
6155,785,"In 2009, Barcelona won the continental treble.",3311,354,"3311,3311","354,356"
6156,785,Barcelona won La Liga in 2009.,3311,354,"3311,3311","354,356"
6160,785,Barcelona completed the sextuple in 2009.,2311,354,"2311,3301","354,356"
6162,785,Barcelona won the UEFA Super Cup in 2009.,3311,354,"3311,3311","354,356"
6163,785,Barcelona won the FIFA Club World Cup in 2009.,3311,354,"3311,3311","354,356"
6164,785,"In 2011, Barcelona became European champions.",2311,354,"2311,3311","354,356"
6166,785,Barcelona won 14 trophies in 4 years under Pep Guardiola.,3311,354,"3311,3311","354,356"
6167,785,The Barcelona team under Pep Guardiola is considered by some to be the greatest team of all time.,3311,354,"3311,3311","354,356"
6168,1404,Tiger Woods won his first major at the 1997 Masters.,,,,
6169,1404,Tiger Woods set a record at the 1997 Masters with a 12-stroke win.,,,,
6170,1404,"Tiger Woods earned $486,000 from winning the 1997 Masters.",,,,
6172,1404,Tiger Woods became a professional golfer less than a year before reaching the number one ranking.,,,,
6173,4387,Justice League is an American superhero film.,,,,
6174,4387,Justice League is based on the DC Comics superhero team.,,,,
6175,4387,Justice League is distributed by Warner Bros. Pictures.,,,,
6176,4387,Justice League is part of the DC Extended Universe.,,,,
6177,4387,Justice League is the fifth installment in the DC Extended Universe.,,,,
6178,1994,Seven Days in May is a 1964 American political thriller motion picture.,,,,
6179,1994,Seven Days in May depicts a planned military-political cabal take-over of the United States government.,,,,
6180,1994,The take-over in Seven Days in May is in reaction to a disarmament treaty with the Soviet Union.,,,,
6183,1994,Kirk Douglas starred in Seven Days in May.,,,,
6184,1994,Fredric March starred in Seven Days in May.,,,,
6185,1994,Ava Gardner starred in Seven Days in May.,,,,
6187,1994,Seven Days in May is based on a novel.,,,,
6188,1994,Fletcher Knebel co-authored the novel Seven Days in May.,,,,
6189,1994,Charles W. Bailey II co-authored the novel Seven Days in May.,,,,
6190,1994,The novel Seven Days in May was published in September 1962.,,,,
6191,227,Margot Kidder worked in independent films in the 2000s.,,,,
6192,227,Margot Kidder had guest-starring roles on television.,,,,
6193,227,Margot Kidder appeared on Smallville.,,,,
6194,227,Margot Kidder appeared on Brothers & Sisters.,,,,
6195,227,Margot Kidder appeared on The L Word.,,,,
6196,227,Margot Kidder won an Emmy Award in 2015.,,,,
6197,227,Margot Kidder won for her performance in R.L. Stine's The Haunting Hour.,,,,
6198,227,Margot Kidder has acted in theatrical productions.,,,,
6199,227,Margot Kidder appeared on Broadway in 2002.,,,,
6200,227,Margot Kidder was in a production of The Vagina Monologues.,,,,
6201,3090,Zinedine Zidane was named FIFA World Player of the Year three times.,,,,
6202,3090,Zinedine Zidane won the FIFA World Player of the Year in 1998.,,,,
6203,3090,Zinedine Zidane won the FIFA World Player of the Year in 2000.,,,,
6204,3090,Zinedine Zidane won the FIFA World Player of the Year in 2003.,,,,
6205,3090,Zinedine Zidane won the 1998 Ballon d'Or.,,,,
6206,3090,Zinedine Zidane was Ligue 1 Player of the Year in 1996.,,,,
6207,3090,Zinedine Zidane was Serie A Footballer of the Year in 2001.,,,,
6208,3090,Zinedine Zidane was La Liga Best Foreign Player in 2002.,,,,
6210,3090,The FIFA 100 is a list of the world's greatest living players.,,,,
6212,4223,The UK has a high-income economy.,,,,
6213,4223,The UK is very high in the Human Development Index.,,,,
6214,4223,The UK ranks 16th in the world in the Human Development Index.,,,,
6215,4223,The UK was the world's first industrialised country.,,,,
6217,4223,The UK is considered a great power.,,,,
6218,4223,The UK has considerable economic influence internationally.,,,,
6219,4223,The UK has considerable cultural influence internationally.,,,,
6220,4223,The UK has considerable military influence internationally.,,,,
6221,4223,The UK has considerable scientific influence internationally.,,,,
6222,4223,The UK has considerable political influence internationally.,,,,
6223,6405,The Amazon River basin is part of Brazil.,,,,
6224,6405,Brazil's Amazon River basin is a vast tropical forest.,,,,
6225,6405,Brazil's Amazon River basin is home to diverse wildlife.,,,,
6226,6405,Brazil's Amazon River basin contains a variety of ecological systems.,,,,
6227,6405,Brazil has extensive natural resources.,,,,
6228,6405,Brazil's natural resources span numerous protected habitats.,,,,
6229,6405,Brazil is one of 17 megadiverse countries.,,,,
6230,6405,Brazil's environmental heritage is a subject of global interest.,,,,
6231,6405,Brazil's environmental heritage is a subject of global debate.,,,,
6232,6405,Brazil's environmental heritage involves debates about deforestation.,,,,
6233,6405,Brazil's environmental heritage involves debates about environmental protection.,,,,
6234,6405,Brazil was inhabited by numerous tribal nations prior to 1500.,,,,
6235,6405,Pedro Álvares Cabral landed in Brazil in 1500.,,,,
6236,6405,Pedro Álvares Cabral claimed Brazil for the Portuguese Empire.,,,,
6237,1859,A crown colony was a type of colonial administration for the British Empire's overseas territories.,3311,356,"3311,3311","356,360"
6238,1859,Crown colonies were also known as royal colonies in the 17th century.,3311,356,"3311,3311","356,360"
6239,1859,"Since 2002, a crown colony is known as a British Overseas Territory.",3311,356,"3311,3311","356,360"
6240,1859,Crown colonies were ruled by a governor.,3201,356,"3201,3311","356,360"
6241,1859,The governor of a crown colony was appointed by the monarch.,3311,356,"3311,3311","356,360"
6242,5712,Prometheus shares 'strands of Aliens DNA'.,,,,
6243,5712,Prometheus is set in the same universe as Aliens.,,,,
6244,5712,Prometheus explores its own mythology.,,,,
6245,5712,Prometheus explores its own ideas.,,,,
6246,5712,Prometheus entered production in April 2010.,,,,
6247,5712,Prometheus had extensive design phases.,,,,
6248,5712,Prometheus required the development of technology and creatures.,,,,
6249,5712,Principal photography for Prometheus began in March 2011.,,,,
6250,5712,Prometheus had an estimated budget of US$ 120 - 130 million.,,,,
6251,2332,Taiwan transitioned from a one-party military dictatorship to a multi-party democracy in the 1980s and early 1990s.,,,,
6252,2332,The Kuomintang dominated Taiwan when it was a one-party military dictatorship.,,,,
6253,2332,Taiwan has a semi-presidential system.,,,,
6254,2332,Taiwan is the 22nd-largest economy in the world.,,,,
6255,2332,Taiwan's high-tech industry is significant in the global economy.,,,,
6256,2332,Taiwan is ranked highly for freedom of the press.,,,,
6257,2332,Taiwan is ranked highly for healthcare.,,,,
6258,2332,Taiwan is ranked highly for public education.,,,,
6259,2332,Taiwan is ranked highly for economic freedom.,,,,
6260,2332,Taiwan is ranked highly for human development.,,,,
6261,3589,Dan Aykroyd conceived Ghostbusters.,,,,
6264,3589,Ghostbusters has a sequel named Ghostbusters II.,,,,
6265,3589,Ghostbusters led to the creation of a media franchise.,,,,
6267,3589,Dan Aykroyd was recognized for his work in the 1989 film Driving Miss Daisy.,,,,
6268,3589,Dan Aykroyd starred in a sitcom called Soul Man.,,,,
6269,3589,Soul Man aired from 1997 to 1998.,,,,
6270,4324,Muammar Gaddafi was decorated with various awards.,,,,
6271,4324,Muammar Gaddafi was recognized for his anti-imperialist stance.,,,,
6272,4324,Muammar Gaddafi supported Arab unity.,,,,
6273,4324,Muammar Gaddafi supported African unity.,,,,
6274,4324,Muammar Gaddafi's government improved the Libyan people's quality of life.,,,,
6275,4324,Muammar Gaddafi's social and economic reforms faced opposition from Islamic fundamentalists.,,,,
6276,4324,Muammar Gaddafi was condemned internationally as a dictator.,,,,
6277,4324,Muammar Gaddafi's administration violated human rights of Libyan citizens.,,,,
6278,4324,Muammar Gaddafi's administration financed global terrorism.,,,,
6279,3690,Harry Potter and the Deathly Hallows was released on 21 July 2007.,,,,
6280,3690,Bloomsbury Publishing released Harry Potter and the Deathly Hallows in the United Kingdom.,,,,
6281,3690,Scholastic released Harry Potter and the Deathly Hallows in the United States.,,,,
6282,3690,Raincoast Books released Harry Potter and the Deathly Hallows in Canada.,,,,
6283,3690,Harry Potter and the Deathly Hallows is the final book in the series that began in 1997.,,,,
6284,3690,The series began with the publication of Harry Potter and the Philosopher's Stone.,,,,
6285,3690,Harry Potter and the Deathly Hallows follows the events of Harry Potter and the Half-Blood Prince.,,,,
6286,3690,Harry Potter and the Deathly Hallows includes the final confrontation between Harry Potter and Lord Voldemort.,,,,
6287,3690,Harry Potter and the Deathly Hallows reveals the back story of several main characters.,,,,
6288,3690,The title 'Deathly Hallows' refers to three mythical objects in the story.,,,,
6289,3690,"The Deathly Hallows consist of an unbeatable wand, a stone to bring the dead to life, and a cloak of invisibility.",,,,
6290,1211,Snowpiercer is a film released in 2013.,,,,
6291,1211,Snowpiercer is an English-language film.,,,,
6292,1211,Snowpiercer is a South Korean-Czech production.,,,,
6293,1211,Snowpiercer is a science fiction thriller film.,,,,
6294,1211,Snowpiercer is based on the French graphic novel Le Transperceneige.,,,,
6295,1211,"Jacques Lob, Benjamin Legrand, and Jean-Marc Rochette created the graphic novel Le Transperceneige.",,,,
6297,1211,Bong Joon-ho and Kelly Masterson wrote Snowpiercer.,,,,
6298,1211,Snowpiercer is Bong Joon-ho's English-language debut.,,,,
6299,1211,80% of Snowpiercer was shot in English.,,,,
6300,318,Zooey Deschanel has played Jessica Day on the sitcom New Girl since 2011.,,,,
6301,318,Zooey Deschanel has received an Emmy Award nomination.,,,,
6302,318,Zooey Deschanel has received three Golden Globe Award nominations.,,,,
6303,318,Zooey Deschanel performed in a jazz cabaret act called If All the Stars Were Pretty Babies.,,,,
6304,318,Zooey Deschanel performed with Samantha Shelton.,,,,
6305,318,Zooey Deschanel plays keyboards.,,,,
6306,318,Zooey Deschanel plays percussion.,,,,
6307,318,Zooey Deschanel plays banjo.,,,,
6308,318,Zooey Deschanel plays ukulele.,,,,
6309,1076,Anni-Frid Synni is also known as Princess Reuss of Plauen.,,,,
6310,1076,Anni-Frid Lyngstad is widely known as Frida Lyngstad.,,,,
6311,1076,Anni-Frid Lyngstad is also known by the mononym Frida.,,,,
6312,1076,Anni-Frid Lyngstad is a Swedish pop and jazz singer.,,,,
6313,1076,Anni-Frid Lyngstad was born in Norway.,,,,
6314,1076,Anni-Frid Lyngstad's mother was Norwegian.,,,,
6315,1076,Anni-Frid Lyngstad's father was German.,,,,
6316,1076,Anni-Frid Lyngstad grew up in Sweden.,,,,
6317,1076,Anni-Frid Lyngstad became internationally famous as a member of ABBA.,,,,
6319,1076,ABBA is one of the best-selling music artists in history.,,,,
6320,3470,Eric Trump is an American businessman.,,,,
6321,3470,Eric Trump is a philanthropist.,,,,
6322,3470,Eric Trump is a former reality TV personality.,,,,
6324,3470,Eric Trump is the third child of Donald Trump.,,,,
6325,3470,Eric Trump is the second son of Ivana Trump.,,,,
6326,3470,Eric Trump serves as a trustee of The Trump Organization.,,,,
6327,3470,Eric Trump works alongside his older brother Donald Trump Jr.,,,,
6328,1705,The Star Wars sequel trilogy films are planned to be released two years apart.,,,,
6329,1705,"Star Wars: The Last Jedi was set for release on December 15, 2017.",,,,
6330,1705,Rian Johnson was the screenwriter for Star Wars: The Last Jedi.,,,,
6331,1705,Rian Johnson was the director of Star Wars: The Last Jedi.,,,,
6332,1705,Episode IX of the Star Wars sequel trilogy was directed by Colin Trevorrow.,,,,
6333,1705,Episode IX was written by Colin Trevorrow and Derek Connolly.,,,,
6334,1705,"Episode IX was scheduled to be released on May 24, 2019.",,,,
6335,5708,"Kiara Saulters was born on May 24, 1995.",3311,354,3311,354
6336,5708,Kiara Saulters is known professionally as Kiiara.,3311,354,3311,354
6337,5708,Kiiara is an American singer.,3311,354,3311,354
6338,5708,Kiiara is a songwriter.,3311,354,3311,354
6339,5708,"Kiiara is from Wilmington, Illinois.",3311,354,3311,354
6340,5708,Kiiara is signed to Atlantic Records.,3311,354,3311,354
6341,3663,Susan Atkins was incarcerated for nearly 40 years.,,,,
6342,3663,Susan Atkins died while in prison.,,,,
6343,3663,Susan Atkins was California's longest-serving female inmate at the time of her death.,,,,
6344,284,Kiiara is signed to Atlantic Records.,,,,
6345,284,Kiiara's music is described as downcast electronic pop.,,,,
6346,284,"Kiiara's music includes bass-heavy, trap-style rap production.",,,,
6348,147,Kenny Rogers retired from show business after a final tour.,,,,
6349,147,Kenny Rogers wanted to spend more time with his family after retirement.,,,,
6350,147,Kenny Rogers has twin boys.,,,,
6351,147,Kenny Rogers is married.,,,,
6352,147,The Gambler is one of Kenny Rogers' albums.,,,,
6353,147,Kenny is one of Kenny Rogers' albums.,,,,
6354,147,The Gambler and Kenny are considered influential country albums.,,,,
6355,147,Kenny Rogers' albums are featured in an About.com poll.,,,,
6356,147,Kenny Rogers was voted the 'Favorite Singer of All-Time' in 1986.,,,,
6357,147,The 'Favorite Singer of All-Time' poll was a joint effort by USA Today and People.,,,,
6358,6198,Indica is a potential subspecies of blue whale found in the Indian Ocean.,,,,
6359,6198,Blue whales primarily feed on small crustaceans known as krill.,,,,
6360,6198,Blue whales are a type of baleen whale.,,,,
6361,6198,Blue whales were abundant in nearly all oceans until the twentieth century.,,,,
6363,606,R. Kelly has released 12 solo studio albums.,3311,354,"3311,3311","354,356"
6364,606,R. Kelly has sold over 100 million records worldwide.,3311,354,"3311,3311","354,356"
6365,606,R. Kelly is considered the most successful R&B male artist of the 1990s.,3311,354,"3311,3311","354,356"
6366,606,R. Kelly has been credited for helping redefine R&B and hip hop.,3311,354,"3311,3311","354,356"
6367,606,R. Kelly has earned the nickname 'King of R&B'.,3311,354,"3311,3311","354,356"
6368,606,R. Kelly has earned the nickname 'King of Pop-Soul'.,3311,354,"3311,3311","354,356"
6369,3992,The Cincinnati Kid is adapted from a novel by Richard Jessup.,,,,
6370,3992,Ring Lardner Jr. wrote the script for The Cincinnati Kid.,,,,
6371,3992,Terry Southern wrote the script for The Cincinnati Kid.,,,,
6372,3992,The Cincinnati Kid was Ring Lardner Jr.'s first major studio work since 1947.,,,,
6373,3992,Ring Lardner Jr. was blacklisted as one of The Hollywood Ten.,,,,
6375,3992,Steve McQueen starred in The Cincinnati Kid.,,,,
6377,3992,Norman Jewison replaced Sam Peckinpah as director of The Cincinnati Kid.,,,,
6378,3992,Norman Jewison describes The Cincinnati Kid as his 'ugly duckling' film.,,,,
6379,5565,ISS components were launched by Russian Proton rockets.,,,,
6380,5565,ISS components were launched by Russian Soyuz rockets.,,,,
6381,5565,ISS components were launched by American Space Shuttles.,,,,
6382,5565,The ISS functions as a microgravity research laboratory.,,,,
6383,5565,The ISS functions as a space environment research laboratory.,,,,
6384,5565,Crew members conduct biology experiments on the ISS.,,,,
6385,5565,Crew members conduct human biology experiments on the ISS.,,,,
6386,5565,Crew members conduct physics experiments on the ISS.,,,,
6387,5565,Crew members conduct astronomy experiments on the ISS.,,,,
6388,5565,Crew members conduct meteorology experiments on the ISS.,,,,
6389,5565,The ISS is used for testing spacecraft systems.,,,,
6390,5565,The ISS is used for testing equipment for Moon missions.,,,,
6391,5565,The ISS is used for testing equipment for Mars missions.,,,,
6393,2837,Ruth Negga is an Ethiopian born Irish actress.,,,,
6394,2837,Ruth Negga appeared in the film Capital Letters released in 2004.,,,,
6395,2837,Ruth Negga appeared in the film Trafficked.,,,,
6396,2837,Ruth Negga appeared in the film Isolation released in 2005.,,,,
6397,2837,Ruth Negga appeared in the film Breakfast on Pluto released in 2005.,,,,
6398,2837,Ruth Negga appeared in the film Warcraft released in 2016.,,,,
6399,2837,Ruth Negga played roles in television.,,,,
6400,2837,Ruth Negga was in the BBC's mini-series Criminal Justice.,,,,
6401,2837,Ruth Negga was in RTÉ's Love/Hate.,,,,
6402,2837,Ruth Negga was in E4's Misfits.,,,,
6403,2837,Ruth Negga was in ABC's Marvel's Agents of S.H.I.E.L.D..,,,,
6404,2837,Ruth Negga began a starring role as Tulip O'Hare in AMC's Preacher in 2016.,,,,
6406,2238,Teenagers in superhero comic books were usually sidekicks in the early 1960s.,,,,
6407,2238,The Spider-Man series featured Peter Parker as the main character.,,,,
6408,2238,Peter Parker is Spider-Man's secret identity.,,,,
6409,2238,Peter Parker is a high school student.,,,,
6410,2238,Spider-Man was created without a superhero mentor.,,,,
6411,2238,Spider-Man learned that 'with great power there must also come great responsibility'.,,,,
6412,2238,The phrase 'with great power there must also come great responsibility' appeared in the final panel of the first Spider-Man story.,,,,
6413,2238,The phrase 'with great power there must also come great responsibility' was later attributed to Uncle Ben.,,,,
6414,1293,Emily Dickinson was an American poet.,,,,
6415,1293,"Emily Dickinson lived from December 10, 1830, to May 15, 1886.",,,,
6416,1293,Emily Dickinson is considered one of the most important American poets of the 19th century.,,,,
6417,2721,Sayyeshaa is an Indian film actress.,,,,
6418,2721,Sayyeshaa appears in Hindi films.,,,,
6419,2721,Sayyeshaa appears in Tamil films.,,,,
6420,2721,Sayyeshaa appears in Telugu films.,,,,
6421,2721,Sayyeshaa starred in a Telugu film called Akhil in 2015.,,,,
6423,2721,Sayyeshaa's Bollywood debut was in a film called Shivaay.,,,,
6424,2721,Sayyeshaa's Bollywood debut film Shivaay starred Ajay Devgn.,,,,
6425,1716,Minions is a 2015 American film.,,,,
6426,1716,Minions is computer-animated.,,,,
6427,1716,Minions is a comedy film.,,,,
6428,1716,Minions is a spin-off/prequel to the Despicable Me franchise.,,,,
6429,1716,Illumination Entertainment produced Minions for Universal Pictures.,,,,
6431,1716,Kyle Balda directed Minions.,,,,
6432,1716,Brian Lynch wrote Minions.,,,,
6433,1716,Chris Meledandri produced Minions.,,,,
6434,1716,Janet Healy produced Minions.,,,,
6435,1716,Pierre Coffin voiced the Minions in the film.,,,,
6436,1716,Sandra Bullock voiced a character in Minions.,,,,
6437,1716,Jon Hamm voiced a character in Minions.,,,,
6438,1716,Michael Keaton voiced a character in Minions.,,,,
6439,1716,Allison Janney voiced a character in Minions.,,,,
6440,1716,Steve Coogan voiced a character in Minions.,,,,
6441,1716,Jennifer Saunders voiced a character in Minions.,,,,
6442,1716,Geoffrey Rush provided narration for Minions.,,,,
6443,2894,The Preacher's Wife soundtrack is the best-selling gospel album in history.,,,,
6444,2894,"Whitney Houston died on February 11, 2012.",,,,
6445,2894,Whitney Houston was found dead in a guest room at the Beverly Hilton.,,,,
6446,2894,"The Beverly Hilton is located in Beverly Hills, California.",,,,
6447,2894,The official coroner's report stated Whitney Houston accidentally drowned in the bathtub.,,,,
6448,2894,Heart disease was a contributing factor in Whitney Houston's death.,,,,
6449,2894,Cocaine use was a contributing factor in Whitney Houston's death.,,,,
6450,1981,"Donald Glover released his first album, Camp, on November 15, 2011.",,,,
6451,1981,"Donald Glover's first album, Camp, received generally positive reviews.",,,,
6452,1981,"Donald Glover released his second studio album, Because the Internet, on December 10, 2013.",,,,
6453,1981,Donald Glover was nominated for a Grammy Award for Best Rap Album for Because the Internet in 2015.,,,,
6454,1981,Donald Glover was nominated for a Grammy Award for Best Rap Performance for his single '3005' in 2015.,,,,
6455,3769,Dennis Hastert was a high school teacher from 1965 to 1981.,,,,
6456,3769,Dennis Hastert was a coach from 1965 to 1981.,,,,
6457,3769,Dennis Hastert lost an election for the Illinois House of Representatives in 1980.,,,,
6458,3769,Dennis Hastert won a seat in the Illinois House of Representatives in 1981.,,,,
6459,3769,Dennis Hastert was first elected to the United States House of Representatives in 1986.,,,,
6460,3769,Dennis Hastert was re-elected to the United States House of Representatives in every subsequent election until 2007.,,,,
6462,64,Hayden Panettiere began her acting career on One Life to Live.,,,,
6463,64,Hayden Panettiere played Sarah Roberts from 1994 to 1997.,,,,
6464,64,Hayden Panettiere appeared on Guiding Light.,,,,
6465,64,Hayden Panettiere played Lizzie Spaulding from 1996 to 2000.,,,,
6466,64,Hayden Panettiere starred as Sheryl Yoast in Remember the Titans at age 10.,,,,
6467,64,Hayden Panettiere portrayed the title character in Amanda Knox: Murder on Trial in Italy.,,,,
6468,64,Hayden Panettiere played Kirby Reed in Scream 4.,,,,
6469,64,Hayden Panettiere received Golden Globe nominations in 2012 and 2013.,,,,
6470,64,Hayden Panettiere was nominated for Best Supporting Actress for her work on Nashville.,,,,
6471,6257,The Beatles produced innovative recordings from 1965 onwards.,,,,
6472,6257,The Beatles released the album Rubber Soul in 1965.,,,,
6473,6257,The Beatles released the album Revolver in 1966.,,,,
6474,6257,The Beatles released the album Sgt. Pepper's Lonely Hearts Club Band in 1967.,,,,
6475,6257,The Beatles released an album commonly known as the White Album in 1968.,,,,
6476,6257,The Beatles released the album Abbey Road in 1969.,,,,
6478,6257,"After breaking up, each member of The Beatles enjoyed successful solo musical careers.",,,,
6479,6257,Paul McCartney remains musically active.,,,,
6480,6257,Ringo Starr remains musically active.,,,,
6481,159,Seinfeld has been in syndication since 2002.,2311,356,2311,356
6482,159,Sony Pictures Television has distributed Seinfeld since 2002.,3311,356,3311,356
6483,159,David and Seinfeld were the main writers of the series.,3311,356,3311,356
6484,159,Larry Charles was a script writer for Seinfeld.,3311,356,3311,356
6485,159,Peter Mehlman was a script writer for Seinfeld.,3311,356,3311,356
6486,159,Gregg Kavet was a script writer for Seinfeld.,3311,356,3311,356
6488,159,David Mandel was a script writer for Seinfeld.,3311,356,3311,356
6489,159,Jeff Schaffer was a script writer for Seinfeld.,3311,356,3311,356
6490,159,Steve Koren was a script writer for Seinfeld.,3311,356,3311,356
6491,159,Jennifer Crittenden was a script writer for Seinfeld.,3311,356,3311,356
6492,159,Tom Gammill was a script writer for Seinfeld.,3311,356,3311,356
6493,159,Max Pross was a script writer for Seinfeld.,3311,356,3311,356
6494,159,Dan O'Keefe was a script writer for Seinfeld.,3311,356,3311,356
6495,159,Charlie Rubin was a script writer for Seinfeld.,3311,356,3311,356
6496,159,Marjorie Gross was a script writer for Seinfeld.,3311,356,3311,356
