id,sentence,claims,focus,coverage,redundance,model,user,cross_focus,cross_coverage,cross_users
326,4213,"Seth Rogen received Emmy Award for his work on Da Ali G Show.
Seth Rogen received an Emmy nomination on Da Ali G Show.
Undeclared hired Seth Rogen as a staff writer.
Seth Rogen was from Oregon when Freaks and Geeks was cancelled.
Freaks and Geeks was the name of Seth Rogen's first film.
Rogen played Freaks and Geeks on American Idol.
Judd Apatow guided Seth Rogen toward a film career.
Seth Rogen worked as a staff writer on the final season of Da Ali G Show.
Seth Rogen played Freaks and Geeks on American Idol.
Freaks and Geeks lasted one season.
Seth Rogen moved to Portland for his role in Freaks and Geeks.",,,,qacg,,,,
327,697,"The official name of Ecuador is Ecuador.
Another name for Ecuador Ecuador is Ikwadur.
The Pacific Ocean is west of Ecuador.
The official name of the Republic of Ecuador is República del Ecuador.
Colombia borders Ecuador on the north.
The Galápagos Islands are about 1000 km west of the mainland.
The official name of the Republic of Ecuador is Ikwadur Ripuwlika.
Ecuador is located in South America.
Ecuador includes the Galápagos Islands in the Pacific Ocean.
The Pacific ocean is west of Ecuador.
Peru is the country that borders Ecuador on the east and south.
The official name of Ecuador Ecuador is the Republic of Ecuador.
The literal translation of the Republic of Ecuador is Equator.",,,,qacg,,,,
328,5169,"Lord Eugene De Vere went to Hampton Court to play tennis.
The modern game of tennis originated in Birmingham.
The modern game of tennis originated in Birmingham, England in the late 19th century.
The modern game of tennis originated in England.
Lord Eugene De Vere announced that he would go down to Hampton Court and play tennis in the novel Sybil (1845).
Eugene De Vere wrote the novel Sybil.
The rules of tennis changed little in the 1890s.
Disraeli wrote the novel Sybil.
The term ""tennis"" referred to real tennis during the 19th century.",,,,qacg,,,,
329,4304,"One of Angela Lansbury's best performances were in The Manchurian Candidate.
Angela Lansbury appeared in eleven MGM films.
Angela Lansbury was the name of the actress who appeared in eleven MGM films.
Angela Lansbury played in Mame (1966).
Angela Lansbury appeared in The Manchurian Candidate (1962).
Angela Lansbury's contract ended in 1952.
Angela Lansbury was a journalist.
Angela Lansbury worked for MGM.
Angela Lansbury played in Broadway in 1966.",,,,qacg,,,,
330,5157,"Margaret Thatcher was British.
Margaret Thatcher's political style is called ThatcherismThatcherism.
Margaret Thatcher was leader of her party from 1975 to 1990.
Along with Tony Blair and David Cameron, John Major was a supporter of Thatcherism.
Margaret Thatcher was the leader of the British Conservative Party from 1975 to 1990.
Along with John Major and David Cameron, Tony Blair was a supporter of Thatcherism.
Along with John Major, Tony Blair and John Major, David Cameron was a supporter of Thatcherism.
An exponent or supporter of Thatcherism is regarded as Thatcherite.
Margaret Thatcher was Prime Minister from 1979 to 1990.
Margaret Thatcher is the name of Margaret Thatcher.
The term Thatcherism describes Margaret Thatcher's political style.
Margaret Thatcher was a member of the Conservative Party.",,,,qacg,,,,
331,3745,"Along with Facebook, Twitter, and Instagram, Claudia Leitte has a large following.
Claudia Leitte has 36 million followers on Twitter.
Claudia Leitte is one powerful person.
Claudia Leitte has sold 2 million records.
Claudia Leitte received three World Music Awards nominations in 2014.
Claudia Leitte won the Latin Grammy award.
Claudia Leitte has more than 36 million followers on Facebook, Instagram, and Twitter.
Claudia Leitte has 36 million followers on Facebook.
Claudia Leitte is based in Latin America.
Claudia Leitte is a coach and mentor of the Brazilian version of The Voice.
Claudia Leitte became a coach and mentor in 2012.
Claudia Leitte is from Brazil.
Claudia Leitte is one of the most popular female acts in Brazil and Latin America.
Claudia Leitte coaches and mentors the Brazilian television show The Voice.
Claudia Leitte received the World Music Awards in 2014.",,,,qacg,,,,
332,5620,"The official name of the Commonwealth of Puerto Rico is Puerto Rico.
Puerto Rico is located in the Caribbean Sea.
Along with Mona, Vieques, and Vieques, a smaller island in the archipelago is Culebra.
Along with Culebra and Vieques, a smaller island in the archipelago is Mona.
Puerto Rico is a part of the United States.
Another name for the Commonwealth of Puerto Rico is Estado Libre Asociado de Puerto Rico.
Along with Mona, Culebra and Vieques, Vieques is part of the archipelago.
Estado Libre Asociado de Puerto Rico means ""Puerto Rico"".
Puerto Rico comes from the Spanish language.
Another name for Puerto Rico is Porto Rico.
The official name of Puerto Rico is the Commonwealth of Puerto Puerto Rico.",,,,qacg,,,,
333,3908,"Schrute has one salesmen.
The nationality of Dwight Schrute III is American.
Rainn Wilson portrays Dwight Schrute III.
Dwight Schrute is also known as Kurt Schrute III.
Dwight Schrute III is a fictional character in the American TV series The Office.
Gareth Keenan was from the UK.
The name of the paper distribution company portrayed by Dwight Schrute III is Dunder Mifflin.
Dwight Kurt Schrute III is Dwight Schrute.
Schrute Farms is the name of the beet plantation where Dwight Schrute III lives.
The name of the paper distribution company portrayed by Dwight Schrute III is Dunder Mifflin.
Dwight Kurt Schrute III is based on Gareth Keenan.
Dwight Schrute III is a fictional character in the American TV series The Office.",,,,qacg,,,,
334,2720,"Denzel Hayes Washington Jr is Denzel Washington.
Denzel Washington Jr. was born on December 28, 1954.
Denzel Washington Jr. starred in the war drama film Glory (1989).
Denzel Washington Jr. received the award of best actor for his role as a corrupt cop in Training Day.
Denzel Washington's real name is Denzel Hayes Washington Jr..
Denzel Washington Jr is American.
Denzel Washington Jr. has won the Golden Globe award.
Denzel Washington Jr. won Best Actor in the 2001 film Training Day.
Denzel Washington Jr. won the Academy Awards: Best Supporting Actor for his role as a corrupt cop in Training Day.
Denzel Washington Jr. has won two Academy Awards.
Denzel Washington Jr. won a Tony Award.
Training Day was released in 2001.
Denzel Washington Jr. has won three Golden Globe awards.",,,,qacg,,,,
335,617,"Lopes'stage name was Left Eye.
Lisa Lopes belonged to one-third of the girl group TLC.
Lisa Lopes was American.
Lisa Lopes belonged to TLC.
Lisa Lopes was born on May 27, 1971 - April 25, 2002.
Lisa Lopes'stage name was Lisa Nicole Lopes.
Lisa Lopes rose to fame in the early 1990s.
Along with Rozonda Thomas, Tionne ""T-Boz"" Watkins was a member of TLC.
Lopes'stage name was Lisa Lopes.
Along with Tionne Watkins, Lisa Lopes was a member of the Rozonda ""Chilli"" Thomas.",,,,qacg,,,,
336,1211,"The language of Snowpiercer is English.
Bong directed Snowpiercer.
Jacques Lob wrote Le Transperceneige.
Approximately 80 % of the film was shot in English.
Snowpiercer is in South Korean.
Snowpiercer is in Czech.
Snowpiercer is based on Le Transperceneige.
Along with Jacques Lob, Jean-Marc Rochette and Jean-Marque Rochettes, Benjamin Legrand starred in Le Transperceneige.
Along with Bong Joon-ho, Kelly Masterson wrote Snowpiercer.
The graphic novel Le Transperceneige is based on the French language.
Snowpiercer was released in 2013.
Jean-Marc Rochette wrote Le Transperceneige.
Bong Joon-ho directed Snowpiercer.",,,,qacg,,,,
337,5794,"Seinfeld was written by David and Seinfeld.
David Mandel wrote the script for Seinfeld.
Tom Gammill wrote the script for Seinfeld.
Seinfeld finished in the top two ratings with NBC's ER from 1994 to 1998.
David wrote the script for Seinfeld It.
Alec Berg wrote the script for Seinfeld.
Steve Koren wrote the script for Seinfeld.
Dan O'Keefe wrote the script for Seinfeld.
Jeff Schaffer wrote the script for Seinfeld.
Marjorie Gross wrote the script for Seinfeld.
Along with Spike Feresten, Elaine Pope was a script writer for Seinfeld.
Gregg Kavet wrote the script for Seinfeld.
Seinfeld is considered one of the greatest and most influential sitcoms ever made.
Along with Larry Charles, Peter Mehlman, Greg Kavet, Carol Leifman, Carolleifman, Greg Koren, Dan O'Kee, and Spike Feresten.
Charlie Rubin wrote the script for Seinfeld.
Seinfeld led the Nielsen ratings in seasons six and nine.
Seinfeld had two top ratings between 1994 and 1998.
Peter Mehlman wrote the script for Seinfeld.
Seinfeld ranked in the top two ratings with NBC every year from 1994 to 1998.
Max Pross wrote the script for Seinfeld.
Larry Charles wrote the script for Seinfeld.
Carol Leifer wrote the script for Seinfeld.
Jennifer Crittenden wrote the script for Seinfeld.
Seinfeld led Nielsen in ratings in seasons six and nine.",,,,qacg,,,,
338,2599,"Winona Ryder made her film debut in 1986.
Winona Ryder is American.
Winona Ryder starred in the film Beetlejuice.
Winona Ryder was one of the most successful and iconic actresses in the 1990s.
Winona Ryder ranked one among the most successful actresses of the 1990s.
Beetlejuice was released in 1988.
Winona Ryder's birth name was Winona Laura Horowitz.
Lydia Deetz starred in Tim Burton's film.
The name of Winona Ryder's film debut was Lucas.
The name of the goth teenager in Beetlejuice was Lydia Deetz.
Winona Ryder was the first name of Winona Ryder.
Winona Ryder was born on October 29, 1971.",,,,qacg,,,,
339,5489,"Joe's real name was Rogan.
Joe Rogan started working for the UFC in 1997.
Joe Rogan moved to New York City two years later.
Rogan appeared on the radio show NewsRadio.
Joe Rogan moved to Los Angeles in 1994.
The acronym for the UFC is the Ultimate Fighting Championship.
Joe Rogan moved to Los Angeles in 1994.
Along with NewsRadio, Rogan appeared on the television show Hardball.
Rogan started working for the UFC in 2002.
Another name for the Ultimate Fighting Championship is the UFC.
Joe Rogan signed an exclusive developmental deal with Disney.
Joe Rogan moved to New York City after moving to Los Angeles.
Joe Rogan moved to New York City in 1994.",,,,qacg,,,,
340,4799,"Greenpeace was founded in 1971.
Greenpeace's international coordinating body is located in Amsterdam.
Greenpeace is the name of Greenpeace.
Greenpeace is the name of Greenpeace.
Greenpeace was founded by Canadians.
Greenpeace's goal is Earth.
Greenpeace has offices in over 40 countries.
Greenpeace was founded by the US.
Greenpeace's international coordinating body is located in the Netherlands.",,,,qacg,,,,
341,1964,"Pope Callixtus III authorized the inquisitorial court to examine Joan of Arc's trial.
Joan of Arc was declared a national symbol of France in 1803.
Joan of Arc was declared a martyr by a court authorized by Pope Callixtus III.
Joan of Arc was beatified in 1909.
Joan of Arc was convicted in 1456.
Napoleon Bonaparte declared Joan of Arc a national symbol of France in 1803.
Joan of Arc was canonized in 1920.
Joan of Arc became a symbol of the Catholic League in the 16th century.
Joan of Arc became a symbol of the Catholic League in the 16th century.
In 1803, Joan of Arc was declared a national symbol of France.",,,,qacg,,,,
342,4350,"Josh Kaufman was the winner of season 12 of American Idol.
Sawyer Fredericks was the winner of season 12 of American Idol.
Danielle Bradbery was the winner of season 12 of American Idol.
Chris Blue was the winner of season 12 of American Idol.
The Voice is broadcast on U.S. TV.
Javier Colon was the winner of season 12 of American Idol.
Jermaine Paul was the winner of season 12 of American Idol.
Craig Wayne Boyd was the winner of season 12 of American Idol.
Alisan Porter was the winner of season 12 of American Idol.
Tessanne Chin was the winner of season 12 of American Idol.
Sundance Head won season 12 of American Idol.
The Voice receives a record deal with Universal Music Group.
The winner receives 100,000 for winning The Voice.
Winners of American Idol have been announced in the twelve seasons.
Cassadee Pope was the winner of season 12 of American Idol.
The iTunes Store is used to determine the winner of American Idol.
The winner receives US for winning The Voice.
Jordan Smith was the winner of season 12 of American Idol.
Voice is the name of the US television series that determines the winner.",,,,qacg,,,,
343,3712,"The name of Arthur Conan Doyle's detective stories is Sherlock Holmes.
The name of the television series based on Arthur Conan Doyle's Sherlock Holmes stories is Sherlock.
Benedict Cumberbatch stars as Sherlock Holmes.
Martin Freeman stars as Doctor John Watson.
Martin Freeman plays John Watson.
Steven Moffat created Sherlock.
Along with Steven Moffat, Mark Gatiss created Sherlock.
Arthur Conan Doyle's wrote the Sherlock Holmes stories.",,,,qacg,,,,
344,3590,"The name of the singer who moved to New York in 1977 is Madonna.
Madonna moved to New York City in 1977.
Madonna won the Grammy Award for Ray of Light.
The name of Madonna's 1998 album was Ray of Light.
Madonna was born in Michigan.
Sire Records is an auxiliary label of Warner Bros..
Madonna signed with Sire Records in 1982.
Madonna signed with Sire Records in 1982.
Madonna released her first album the following year.
Madonna won the Emmy award.
Madonna released Confessions on a Dance Floor in 2005.
Ray of Light was released in 1998.
Along with Emmy, Madonna performed in the music group Breakfast Club.
Madonna was born in Bay City.
The title of Madonna's 2005 album was Confessions on a Dance Floor.
Madonna moved to New York City in 1977.",,,,qacg,,,,
345,803,"The name of the British television series that won a Peabody Award in 2011 is Sherlock.
Sherlock received a Peabody Award in 2011.
Interest in the fourth series of Sherlock slipped by approximately twenty percent.
The third series of Sherlock is the UK's most watched drama series.
Sherlock received a Peabody Award in 2011.
The most watched series in the UK is fourth.
The third series of Sherlock became the most watched series in the UK in 2001.
Sherlock has been sold to 180 territories.
Third series has become the UK's most watched drama series since 2001.",,,,qacg,,,,
346,4370,"The name of Rupert Murdoch's company was News Corporation.
Rupert Murdoch's News Corporation was Murdoch.
Murdoch's News Corporation acquired HarperCollins in 1989.
Murdoch's News Corporation acquired The Wall Street Journal in 2007.
Murdoch's News Corporation acquired The Wall Street Journal in 2007.
Murdoch's News Corporation acquired Twentieth Century Fox in 1985.
Rupert Murdoch's News Corporation acquired Twentieth Century Fox in 1985.
Rupert Murdoch formed BSkyB in 1990.
Murdoch's News Corporation acquired Twentieth Century Fox, HarperCollins, and The Wall Street Journal from Rupert MurdochMurdog's.
Murdoch's net worth in 2000 was over $ 5 billion.
Rupert Murdoch's News Corporation acquired HarperCollins in 1989.
Murdoch's News Corporation owned more than 50 countries in 2000.
Along with Asian networks, Murdochs News Corporation expanded into South American in the 1990s.
Murdoch's News Corporation expanded into Asian networks and South American television during the 1990s.
Rupert Murdoch's News Corporation was Murdoch.
Murdoch's News Corporation owned over 800 companies in more than 50 countries in 2000.
The name of the British broadcaster founded by Rupert Murdoch was BSkyB.
Murdoch's News Corporation expanded into Asian networks in the 1990s.
The nationality of BSkyB was British.
Murdoch's News Corporation owned over 800 companies in 2000.",,,,qacg,,,,
347,5532,"A A Dance with Dragons features Jon Snow as a prominent character.
Jon Snow appeared briefly in A Feast for Crows in 2005.
Jon is the Lord Commander of the Watch.
Jon Snow is trying to negotiate an alliance with the Night's Watch in A Dance with Dragons.
A Dance with Dragons was released in 2011.
Jon Snow is now the Lord Commander of Watch.
Jon Snow is the Lord Commander of the Watch.
Jon Snow appeared briefly in the 2005 film A Feast for Crows.",,,,qacg,,,,
348,4,"Roald Dahl received the World Fantasy Award for Life Achievement in 1983.
Dahl won the 1983 World Fantasy Award for Life Achievement.
Roald Dahl won the British book awards in 1990.
The Times placed Dahl on its list of the 50 greatest British writers since 1945 in Dahl 16th.
Dahl received the British Book Awards' Childrens Author of the Year award in 1990.
Roald Dahl won the 1983 World Fantasy Award for Life Achievement.
The Times placed Dahl 16th on its list of the 50 greatest British writers since 1945 in 2008.
The British Book Awards award Dahl for Children's Author of the Year in 1990.
Roald Dahl received the World Fantasy Award for Life Achievement in 1983.
The Times placed Dahl on its list of the 50 greatest British writers in 1945.
The Times placed Dahl on 50 greatest British writers in 2008.
The Times placed Dahl 16th on its list of the 50 greatest British writers since 1945.",,,,qacg,,,,
349,1378,"The second largest media conglomerate in terms of revenue is the Walt Disney Company.
The Walt Disney Studios is located in California.
The headquarters of the Walt Disney Company is at the WaltDisney Studios.
The nationality of the Walt Disney Company is American.
The Walt Disney Studios is located in Burbank.
The Walt Disney Company ranks second in terms of revenue.
Comcast is the largest media conglomerate in the world.
The common name of the Walt Disney Company is Disney.",,,,qacg,,,,
350,4499,"Eva Green portrayed Vesper Lynd in the James Bond film Casino Royale.
The film Casino Royale was released in 2006.
Eva Green played Sibylla in Ridley Scott's Kingdom of Heaven.
The Dreamers was the film that Eva Green made her film debut in 2003.
The real name of Eva Green is Eva Gaëlle Green.
Kingdom of Heaven was released in 2005.
Eva Green is French.
Vesper Lynd was a Bond type girl.
Eva Green portrayed Vesper Lynd in the film James Bond.
The Ridley Scott film that Eva Green appeared in was Kingdom of Heaven.
Eva Green was born on 6 July 1980.
Sibylla was in Jerusalem in Kingdom of Heaven.
Eva Green portrayed Vesper Lynd in the James Bond film Casino Royale.
Eva Green made her film debut in 2003.
Bernardo Bertolucci directed the film The Dreamers.
The real name of Eva Galle Green is Eva Green.
Eva Green appeared in the film Ridley Scott's.",,,,qacg,,,,
351,4840,"California is credited with improving relations with Mexico.
Davis supported laws to ban assault weapons.
Davis helped improve relations with Mexico.
Davis improved relations between California and Mexico.",,,,qacg,,,,
352,3052,"Angela Lansbury has spent most of her career in the United States.
Angela Lansbury was the daughter of Moyna Macgill and Edgar Lansbury.
Angela Lansbury moved to the United States in 1940.
Angela Lansbury's father was Edgar Lansbury.
Angela Lansbury's career has spanned seven decades.
Angela Lansbury had two younger brothers.
Angela Lansbury was born in London.
Blitz caused Angela Lansbury to move to the United States.
The name of Angela Lansbury is Lansbury.
Moyna Macgill was Angela Lansbury's mother.
Angela Lansbury studied acting in New York City.",,,,qacg,,,,
353,5302,"There is one episode of Sherlock.
Benedict Cumberbatch stars as Sherlock Holmes.
Martin Freeman plays John Watson.
The three-part Sherlock series aired in 2010 - 2017.
Benedict Cumberbatch plays the character Sherlock Holmes.
The TV series Sherlock stars Benedict Cumberbatch as Sherlock Holmes.
Martin Freeman plays John Watson.
The one-off special feature is Victorian period fantasy.
Steven Moffat created Sherlock.
Sherlock is set in the present day.
Along with Steven Moffat, Mark Gatiss created Sherlock.
Thirteen episodes of Sherlock have been produced.
A special episode of Sherlock aired on January 1, 2016.
Benedict Cumberbatch plays Holmes.
Sherlock had three episodes between 2010 and 2017.",,,,qacg,,,,
354,1805,"Tokyo ranked first in the Global Economic Power Index.
Tokyo ranked first in the Global Economic Power Index.
Tokyo was ranked as the 11th most expensive city for expatriates in 2015.
Tokyo ranked 11th among expatriates in 2015.
Michelin has awarded Tokyo the most Michelin stars of any city in the world.
GaWC listed Tokyo as an alpha + world city in 2008.
Tokyo was ranked first in the ""Best overall experience"" category of TripAdvisor's World City Survey in 2014.
The Michelin Guide awarded Tokyo the most Michelin stars of any city in the world.
Tokyo was named the Most Liveable City by Monocle in 2015.
Monocle named Tokyo the Most Liveable City in the world in 2015.
Tokyo was considered an alpha + world city in 2008.
Mercer ranked Tokyo as the 11th most expensive city for expatriates in 2015.
Tokyo ranked first in the Global Economic Power Index.
Tokyo ranked fourth in the Global Cities Index.
The World City Survey ranked Tokyo first in the Best overall experience category.
The Economist Intelligence Unit ranked Tokyo as the world's 11th most expensive city for expatriates in 2015.",,,,qacg,,,,
355,438,"Billy Ray Cyrus played the role of Vernon Brownmule on the CMT series Still the King.
Billy Ray Cyrus co-starred in Hannah Montana with Miley Cyrus.
Cyrus starred as Vernon Brownmule on Still the King.
Billy Ray Cyrus starred as Vernon Brownmule on the CMT series Still the King in 2016.
Billy Ray Cyrus was from Montana.
Billy Ray Cyrus moved to New York City.
Billy Ray Cyrus co-starred with Miley Cyrus in the Disney series Hannah Montana.
Billy Ray Cyrus starred as Vernon Brownmule on CMT.
Billy Ray Cyrus co-starred with Miley Cyrus on Disney Channel.
Billy Ray Cyrus co-starred with Miley Cyrus from 2006 to 2011.
Miley Cyrus is Billy Ray Cyrus'daughter.",,,,qacg,,,,
356,1801,"The official language of Somalia is Somali.
The official language of Somalia is Somali.
Somali is spoken as a mother tongue in Somalia.
Somaliland is a national language in Djibouti.
Somali is a working language in the Somali Region of Ethiopia.
Somalis speak Somali as their mother tongue.
Somali is spoken as a mother tongue in Greater Somalia.
The official language of Somalia is Somaliland.",11000000,1,00000000,qacg,356,11000000,1,356
357,1834,"The name of the 2012 film was Prometheus.
Prometheus was released in North America on June 8, 2012.
Prometheus was released on June 8, 2012 in North America.
Prometheus was released in 2012.
Three videos were released with Prometheus.
Prometheus was released in the UK on June 1, 2012.
Prometheus was released in 2012 in the United Kingdom.",0000100,10,0000000,qacg,354,0000100,10,354
358,3092,"The name of Lockheed Martin's Lightning II aircraft is F-35.
Lockheed Martin is the name of the F-35 Lightning II.
Along with Lockheed Martin and BAE Systems, Pratt & Whitney is a major F-35 industry partner.
The F-35 first flew on 15 December 2006.
The United States plans to buy 2,663 aircraft.
Along with Northrop Grumman, Pratt & Whitney, and Lockheed Martin, BAE Systems is a major F-35 industry partner.
Along with Pratt & Whitney and BAE Systems, Northrop Grumman is a major F-35 industry partner.
The US plans to buy 2,663 F-35 Lightning II aircraft.
The F-35 aircraft first flew on December 15, 2006.
The F-35 first flew first.",,,,qacg,,,,
359,5136,"The Preacher's Wife was the best-selling gospel album in history.
Waiting to Exhale was released in 1995.
Whitney Houston is the top female act in the top 10 list of the best-selling albums of all time.
The name of the 1995 film that featured Whitney Houston was Waiting to Exhale.
Whitney Houston's list of the best-selling albums of all time is 10.
The Preacher's Wife was released in 1996.
Houston is the top female act in the top 10 list of the best-selling albums of all time.
Whitney Houston's number on the top 10 best selling albums of all time is four.",,,,qacg,,,,
360,3769,"Dennis Hastert's first seat in the House of Representatives was United States.
Dennis Hastert was elected to the U.S. House of Representatives in 1986.
Dennis Hastert lost his bid for the Illinois House of Representatives in 1980.
Dennis Hastert retired in 1981.
Dennis Hastert lost the House of Representatives seat in 1980.
Dennis Hastert retired in 2007.
Hastert was a high school teacher and coach from 1965 to 1981.
Dennis Hastert was a high school teacher and coach from 1965 to 1981.
Dennis Hastert lost the Illinois House of Representatives seat in 1980.
Dennis Hastert was elected to the U.S. House of Representatives first.
Dennis Hastert was a high school teacher and coach from 1965 to 1981.",,,,qacg,,,,
361,3690,"The name of the book that chronicles the events that followed Harry Potter and the Philosopher's Stone is Harry Potter.
Harry Potter and the Deathly Hallows was released on July 21, 2007.
Along with Harry Potter and Lord Voldemort, the Half-Blood Prince was the main character in the book.
Harry Potter and the Philosophers Stone began in 1997.
Bloomsbury Publishing published Harry Potter and the Deathly Hallows.
Along with Harry Potter and the Deathly Hallows, the Philosophers Stone ended the series that began in 1997.
Scholastic published Harry Potter and the Deathly Hallows in the United States.
Harry Potter and the Half-Blood Prince was published in 2005.
Raincoast Books published Harry Potter and the Deathly Hallows in Canada.
Harry Potter and the Deathly Hallows was published in Canada.
Voldemort was the Lord of the Deathly Hallows.
Three mythical objects are in the book called the Deathly Hallows.
The three mythical objects in the book are collectively known as the ""Deathly Hallows"".
Scholastic published the book in the United States.
Harry Potter and the Deathly Hallows was published in the United Kingdom.",,,,qacg,,,,
