id,sentence,claims,focus,coverage,redundance,model,user,cross_focus,cross_coverage,cross_users
1341,5647,"Toy Story 3 received four more Academy Award nominations for Best Adapted Screenplay.
Toy Story 3 received Best Sound Editing.
Toy Story 3 received Best Original Song.
Toy Story 3 received four more Academy Award nominations for Best Animated Feature.",,,,t5_small_multiclaim,,,,
1342,3275,"Joe Biden represented Delaware as a United States Senator.
Joe Biden was a member of the Democratic Party.
Joe Biden represented Delaware as a United States Senator from 1973 to 2009.
Joe Biden was a member of the Democratic Party.
Joe Biden was a member of the Democratic Party.",,,,t5_small_multiclaim,,,,
1343,5983,"Brock Lesnar wrestled in the Inoki Genome Federation.
Brock Lesnar was a wrestling champion.
Brock Lesnar was a wrestling champion.
Brock Lesnar was a wrestling champion.
Brock Lesnar was a wrestling champion.",,,,t5_small_multiclaim,,,,
1344,942,"The Houston Rockets have won four Western Conference titles.
The Houston Rockets have won two NBA championships.
The Houston Rockets have won two NBA championships.",,,,t5_small_multiclaim,,,,
1345,5321,"Fiji has more than 500 islets.
Fiji is an archipelago.
Fiji has more than 330 islands.",,,,t5_small_multiclaim,,,,
1346,4831,"Amanda Peet has appeared in a film that was released in 2001.
Amanda Peet has appeared in a film that was released in 2008.
Amanda Peet has appeared in a film that was released in 2006.
Amanda Peet has appeared in a film that was released in 2006.
Amanda Peet has appeared in a film that was released in 2001.
Amanda Peet has appeared in a film that was released in 2008.
Amanda Peet has appeared in a film that was released in 2008.
Amanda Peet has appeared in a variety of films.
Amanda Peet has appeared in",,,,t5_small_multiclaim,,,,
1347,1702,"Ted Kaczynski was a bomber.
Ted Kaczynski was a terrorist.
Ted Kaczynski was a terrorist.
Ted Kaczynski was a victim of a mass bombing.",,,,t5_small_multiclaim,,,,
1348,3102,"Ted Kaczynski was a court-appointed lawyer.
Ted Kaczynski tried unsuccessfully to dismiss his lawyers.
Ted Kaczynski did not believe he was insane.",,,,t5_small_multiclaim,,,,
1349,3994,"The Walt Disney Company owns and operates the ABC broadcast television network.
The Walt Disney Company owns and operates the A+E Networks.
The Walt Disney Company owns and licenses 14 theme parks.
The Walt Disney Company owns and operates the ABC broadcast television network.
The Walt Disney Company owns and operates the ABC broadcast television network.",,,,t5_small_multiclaim,,,,
1350,1771,"James Bond is in the Eon series.
James Bond is in Spectre.
James Bond is in the sixth film in the Eon series.",,,,t5_small_multiclaim,,,,
1351,2136,"Lisa Lopes won four Grammy Awards.
Lisa Lopes worked with TLC.
Lisa Lopes won a Grammy Award.
Lisa Lopes worked with TLC.",1000,0001,0000,t5_small_multiclaim,356,1000,0001,356
1352,1637,"Samuel Weiss has shown how prolactin increases the production of new brain cells.
Samuel Weiss has shown how prolactin increases the production of new brain cells.
Samuel Weiss has shown how new stem cell-generated brain cells can be redirected to part of the rodent brain that are damaged after stroke.
Samuel Weiss has shown how prolactin increases the production of new brain cells.",,,,t5_small_multiclaim,,,,
1353,4376,"A floppy disk is made of a thin magnetic storage medium.
A floppy disk is made of a thin and flexible disk.
A floppy disk is made of a plastic enclosure.
A floppy disk is made of a plastic enclosure.",,,,t5_small_multiclaim,,,,
1354,1326,"Ozzy Osbourne has a strong Brummie accent.
Ozzy Osbourne has a star on the Birmingham Walk of Stars.
Ozzy Osbourne is a native of Birmingham.
Ozzy Osbourne has a strong Brummie accent.",,,,t5_small_multiclaim,,,,
1355,4109,"Room was directed by Lenny Abrahamson.
Room was written by Emma Donoghue.
Room was written by Emma Donoghue.
Room was released in 2015.
Room was released in 2015.
Room was directed by Lenny Abrahamson.
Room was written by Emma Donoghue.
Room was written by an Australian.",,,,t5_small_multiclaim,,,,
1356,2720,"Denzel Washington is an actor.
Denzel Washington is a director.
Denzel Washington is a producer.
Denzel Washington was born in 1954.
Denzel Washington is an American.
Denzel Washington is an American.",,,,t5_small_multiclaim,,,,
1357,5883,"Douglas Aircraft Company was founded by Donald Wills Douglas.
Douglas Aircraft Company was merged with McDonnell Aircraft in 1967.
Douglas Aircraft Company was founded in 1921.
Douglas Aircraft Company was a company that merged with McDonnell Aircraft.
Douglas Aircraft Company was a company that merged with McDonnell Aircraft.",,,,t5_small_multiclaim,,,,
1358,1394,"Venice was a major financial power during the Middle Ages and Renaissance.
Venice was a staging area for the Crusades.
Venice was a staging area for the Battle of Lepanto.
Venice was a major maritime power.",,,,t5_small_multiclaim,,,,
1359,734,"Star vs. the Forces of Evil is produced by Disney Television Animation.
Star vs. the Forces of Evil is an animated television series.
Star vs. the Forces of Evil is produced by Disney Television Animation.",,,,t5_small_multiclaim,,,,
1360,5182,"Denmark introduced social and labour-market reforms in the early 20th century.
Denmark was an industrialised exporter of agricultural produce.
Denmark introduced the first half of the 19th century social and labour-market reforms.",,,,t5_small_multiclaim,,,,
1361,3745,"Claudia Leitte has sold over 2 million records.
Claudia Leitte is a singer.
Claudia Leitte is a singer.
Claudia Leitte is a singer.
Claudia Leitte is a singer.
Claudia Leitte is a singer.",,,,t5_small_multiclaim,,,,
1362,1317,"FC Barcelona won their fifth Champions League trophy in 2015.
FC Barcelona is a football team.
FC Barcelona won the continental treble twice.",,,,t5_small_multiclaim,,,,
1363,6593,"Broadcast News is a film.
Broadcast News is a romantic comedy-drama film.
Broadcast News is a 1987 film.
Broadcast News is a film.",,,,t5_small_multiclaim,,,,
1364,2419,"The jackfruit is native to parts of South and Southeast Asia.
The jackfruit originated in the western Ghats in the Indian subcontinent.
The jackfruit is a tree.
The jackfruit is also known as jack tree.
The jackfruit is also known as jackfruit.
The jackfruit is also known as jack tree.
The jackfruit is also known as jackfruit.",1100000,11011,0000000,t5_small_multiclaim,354,1100000,11011,354
1365,3092,"Lockheed Martin F-35 Lightning II first flew on December 15, 2006.
Lockheed Martin F-35 Lightning II was first flew on December 15, 2006.
Lockheed Martin F-35 Lightning II is a plane.",,,,t5_small_multiclaim,,,,
1366,3153,"Golden State Warriors are nicknamed the ""Dubs.""
Golden State Warriors are a basketball team.
Golden State Warriors are nicknamed the ""Dubs.""
Golden State Warriors are a team.",,,,t5_small_multiclaim,,,,
1367,1361,"Sister Act stars Whoopi Goldberg.
Sister Act stars a Reno lounge singer.
Sister Act stars a San Francisco convent of Poor Clares.
Sister Act stars a singer who has been put under protective custody.
Sister Act stars a singer who has been put under protective custody.",,,,t5_small_multiclaim,,,,
1368,3220,"Aaron Taylor-Johnson portrayed a Russian aristocrat.
Aaron Taylor-Johnson portrayed Ben in Savages.
Aaron Taylor-Johnson portrayed Lt. Brody in Godzilla.
Aaron Taylor-Johnson portrayed a Russian aristocrat.
Aaron Taylor-Johnson portrayed a Russian aristocrat.
Aaron Taylor-Johnson portrayed a Russian aristocrat.
Aaron Taylor-Johnson portrayed Count Vronsky.
Aaron Taylor-Johnson portrayed Count Vronsky.
Aaron Taylor-Johnson portrayed",,,,t5_small_multiclaim,,,,
1369,4969,"Linkin Park is a band.
Linkin Park's fifth album is Living Things.
Linkin Park's fifth album is Living Things.
Linkin Park's fifth album is a compilation album.
Linkin Park's fifth album is a compilation album.
Linkin Park's fifth album is Living Things.",,,,t5_small_multiclaim,,,,
1370,1242,"Frank Sinatra was an actor.
Frank Sinatra was an American.
Frank Sinatra was a musician.
Frank Sinatra was an American.
Frank Sinatra was a musician.",,,,t5_small_multiclaim,,,,
1371,4276,"Prakash Jha is an actor.
Prakash Jha is an Indian.
Prakash Jha is a director.
Prakash Jha is a film producer.
Prakash Jha is a screenwriter.
Prakash Jha is a film producer.
Prakash Jha is a director.
Prakash Jha is a film producer.
Prakash Jha is a film producer.",,,,t5_small_multiclaim,,,,
1372,2707,"Floyd Mayweather Jr. was ranked the best boxer in the world twice in a span of ten years.
Floyd Mayweather Jr. was ranked the best boxer in the world, pound for pound.
Floyd Mayweather Jr. was ranked by ESPN.
Floyd Mayweather Jr. was ranked the best boxer in the world, twice in a span of ten years.
Floyd Mayweather was ranked the best boxer in the world, pound for pound.
Floyd Mayweather was ranked the best box",,,,t5_small_multiclaim,,,,
1373,3138,"Aaron Taylor-Johnson performed in Nowhere Boy.
Aaron Taylor-Johnson performed in Nowhere Boy.
Aaron Taylor-Johnson performed in Nowhere Boy.
Aaron Taylor-Johnson performed in Nowhere Boy.
Aaron Taylor-Johnson performed in Nowhere Boy.
Aaron Taylor-Johnson performed in Nowhere Boy.
Aaron Taylor-Johnson performed in Nowhere Boy.
Aaron Taylor-Johnson performed in Nowhere Boy.
Aaron Taylor-Johnson performed in Nowhere Boy.
Aaron Taylor-Johnson performed in Nowhere Boy.
Aaron Taylor-Johnson was in a film.
Aaron Taylor-Johnson was",,,,t5_small_multiclaim,,,,
1374,138,"Puerto Rico's population is approximately 3.4 million.
Puerto Rico has a rich history.",,,,t5_small_multiclaim,,,,
1375,5113,"Susan Atkins was a member of Charles Manson's ""Family"".
Susan Atkins was a murderer.
Susan Atkins was a member of Charles Manson's ""Family"".",,,,t5_small_multiclaim,,,,
1376,5967,"Snowpiercer was well received by critics.
Snowpiercer appeared on many film critics' top ten film lists of 2014.
Snowpiercer appeared on many film critics' top ten film lists of 2014.
Snowpiercer was well received by critics.",,,,t5_small_multiclaim,,,,
1377,5868,"Blue whales were hunted almost to extinction.
Blue whales were protected by the international community in 1966.
Blue whales were hunted until protected by the international community.",100,01,000,t5_small_multiclaim,356,100,01,356
1378,2328,"Colombia is a country.
Colombia is a megadiverse country.
Colombia is a region.",,,,t5_small_multiclaim,,,,
1379,605,"Miley Cyrus' father starred in Hannah Montana.
Miley Cyrus was in Doc.
Miley Cyrus's father was Billy Ray Cyrus.",,,,t5_small_multiclaim,,,,
1380,3115,"Muammar Gaddafi was Chairperson of the African Union.
Muammar Gaddafi was President of the African Union.
Muammar Gaddafi was President of the African Union.
Muammar Gaddafi was a president from 2009 to 10.",1000,0000,0000,t5_small_multiclaim,353,1000,0000,353
1382,2950,"The Weeknd released his third studio album in 2016.
The Weeknd received positive critical reception.
The Weeknd released his third studio album in 2016.",,,,t5_small_multiclaim,,,,
1383,1538,"Jacki Weaver worked in Petersen.
Jacki Weaver was in Stork.
Jacki Weaver was a symbol of the Australian New Wave.
Jacki Weaver worked in Alvin Purple.
Jacki Weaver worked in Ozploitation films.",,,,t5_small_multiclaim,,,,
1384,3447,"Allegiant was written by Veronica Roth.
Allegiant was published by HarperCollins.
Allegiant was published in October 2013.
Allegiant was written by Veronica Roth.
Allegiant was published by HarperCollins.
Allegiant is a science fiction novel.",,,,t5_small_multiclaim,,,,
1385,3150,"Luxembourg is a sovereign state.
Luxembourg is about the same size as the US state Rhode Island.
Luxembourg is in Europe.
Luxembourg is in Europe.",,,,t5_small_multiclaim,,,,
1386,3809,"Prague is the capital of the Czech Republic.
Prague is the largest city of the Czech Republic.
Prague is the capital of the Czech Republic.
Prague is the largest city of the Czech Republic.
Prague is the capital of the Czech Republic.",11111,01010,00000,t5_small_multiclaim,356,"11111,11111","01010,01010","356,353"
1387,1007,"James McAvoy is an actor.
James McAvoy is an actor.
James McAvoy is an actor.
James McAvoy is an adult comedy-drama.",,,,t5_small_multiclaim,,,,
1388,3631,"William Jennings Bryan was from Nebraska.
William Jennings Bryan was an orator.
William Jennings Bryan was a politician.
William Jennings Bryan was a dominant force in the populist wing of the Democratic Party.
William Jennings Bryan was a politician.",,,,t5_small_multiclaim,,,,
1389,4056,"Frank Sinatra starred in The Man with the Golden Arm.
Frank Sinatra received critical acclaim.
Frank Sinatra won an Academy Award.
Frank Sinatra starred in The Man with the Golden Arm.
Frank Sinatra starred in The Man with the Golden Arm.
Frank Sinatra starred in The Man with the Golden Arm.
Frank Sinatra starred in The Man with the Golden Arm.
Frank Sinatra starred in The Man with the Golden Arm.
Frank Sinatra starred in The Man with the Golden Arm.
Frank Sinatra received acclaim",,,,t5_small_multiclaim,,,,
1390,1029,"The Second Punic War involved combatants in the western and eastern Mediterranean.
The Second Punic War lasted from 218 to 201 BC.
The Second Punic War involved combatants in the second and second Mediterranean Mediterranean.
The Second Punic War was also called The Hannibalic War.
The Second Punic War involved the Romans.",,,,t5_small_multiclaim,,,,
1391,5856,"Alicia Keys won 16 Grammy Awards.
Alicia Keys won Best Album.
Alicia Keys won Best Album.
Alicia Keys won Best Album.
Alicia Keys won Best Album.
Alicia Keys won Best Album.
Alicia Keys won Best Album.",,,,t5_small_multiclaim,,,,
1392,1913,"Daniela Hantuchová is a tennis player.
Daniela Hantuchová beat Laura Robson in the second round of the Aegon Classic.
Daniela Hantuchová is a Slovak tennis player.",,,,t5_small_multiclaim,,,,
1393,5838,"Get Out is a film.
Get Out is a film.
Get Out is a film.
Get Out is a film.
Get Out is a film.",,,,t5_small_multiclaim,,,,
1394,438,"Billy Ray Cyrus co-starred in Hannah Montana.
Billy Ray Cyrus co-starred in a Disney Channel series.
Billy Ray Cyrus co-starred with Miley Cyrus.
Billy Ray Cyrus co-starred in a Disney Channel series.",,,,t5_small_multiclaim,,,,
1395,4727,"The Cambodian coup of 1970 led to the proclamation of the Khmer Republic.
The Cambodian coup of 1970 led to emergency powers.
The Cambodian coup of 1970 led to the Cambodian Civil War.
The Cambodian coup of 1970 led to the Cambodian Civil War.
The Cambodian coup of 1970 led to the Cambodian Civil War.",,,,t5_small_multiclaim,,,,
1396,3908,"Dwight Schrute is a fictional character.
Dwight Schrute is a character on The Office.
Dwight Schrute is a character on a TV series.
Dwight Schrute is a character on The Office.
Dwight Schrute is a character on a TV series.",,,,t5_small_multiclaim,,,,
1397,741,"Richard III of England died in 1485.
Richard III of England was King of England.
Richard III of England was King of England.
Richard III of England died in the Battle of Bosworth Field.
Richard III of England was King of England.",,,,t5_small_multiclaim,,,,
1398,467,"Colombia has suffered from an asymmetric low-intensity armed conflict.
Colombia has suffered from an asymmetric low-intensity conflict.
Colombia has suffered from an asymmetric low-intensity armed conflict.",,,,t5_small_multiclaim,,,,
1399,4206,"Ruth Negga is an actress.
Ruth Negga was born on January 7th, 1982.
Ruth Negga is Ethiopian born.
Ruth Negga is an actress.
Ruth Negga has appeared in Capital Letters.
Ruth Negga has appeared in Warcraft.
Ruth Negga has appeared in Isolation.
Ruth Negga has appeared in the films Capital Letters.",,,,t5_small_multiclaim,,,,
1400,693,"Muscarinic acetylcholine receptors form G protein-receptor complexes in the cell membrane of certain neurons and other cells.
Muscarinic acetylcholine receptors form G protein-receptor complexes in the cell membrane of certain cells.
Muscarinic acetylcholine receptors are acetylcholine receptors.",,,,t5_small_multiclaim,,,,
1401,638,"The Beatles were a rock band.
The Beatles were a member of a band formed in Liverpool.
The Beatles were a member of a band formed in 1960.
The Beatles were a member of a band formed in Liverpool.",,,,t5_small_multiclaim,,,,
1402,2455,"Vallejo, California is located in the North Bay region of the San Francisco Bay Area.
Vallejo, California is a port city.
Vallejo, California is in Solano County, California.
Vallejo, California is Spanish.",,,,t5_small_multiclaim,,,,
1403,554,"Fiji is northeast of New Zealand's North Island.
Fiji is an island country.
Fiji is in Melanesia.
Fiji is in the South Pacific Ocean.",0000,000,0000,t5_small_multiclaim,356,0000,000,356
1404,295,"Richard Nixon was a president.
Richard Nixon was a president.
Richard Nixon was a president.",,,,t5_small_multiclaim,,,,
1405,6093,"Dennis Hastert is a former congressman.
Dennis Hastert was born in 1942.
Dennis Hastert is a former congressman.
Dennis Hastert was the 51st Speaker of the United States House of Representatives.
Dennis Hastert represented from 1987 to 2007.",,,,t5_small_multiclaim,,,,
1406,5532,"Jon Snow is a character in a dance with dragons.
Jon Snow worked to negotiate an alliance between the Night's Watch and the wildlings.
Jon Snow is a character in a 2011 A Dance with Dragons.",,,,t5_small_multiclaim,,,,
1407,3326,"The Beatles were a drummer.
The Beatles were a drummer.
The Beatles were a drummer.",,,,t5_small_multiclaim,,,,
1408,3590,"Madonna is an auxiliary label.
Madonna signed with Sire Records.
Madonna released her eponymous debut album in 1982.",,,,t5_small_multiclaim,,,,
1409,4982,"Brazil is the world's eighth-largest by nominal GDP.
Brazil is the eighth-largest by GDP.
Brazil is the world's eighth-largest by GDP.",,,,t5_small_multiclaim,,,,
1410,6316,"Anne Bancroft won two Tony Awards.
Anne Bancroft won one Academy Award.
Anne Bancroft won three BAFTA Awards.
Anne Bancroft won two Emmy Awards.
Anne Bancroft won two Golden Globes.",,,,t5_small_multiclaim,,,,
1411,917,"A quarry is a place from which dimension stone, rock, construction aggregate, riprap, sand, gravel, or slate has been excavated.
A quarry is a place from which dimension stone, rock, construction aggregate, riprap, sand, or slate has been excavated from the ground.
A quarry is a place from which dimension stone, rock, or construction aggregate has been excavated.
A quarry is a place from which dimension stone, rock, construction aggregate, riprap, sand",,,,t5_small_multiclaim,,,,
1412,2204,"Tennis is a racket sport.
Tennis can be played individually against a single opponent.
Tennis can be played between two teams of two players each.
Tennis can be played individually against a single opponent.
Tennis can be played between two teams of two players each.",,,,t5_small_multiclaim,,,,
1413,1673,"Clueless stars Stacey Dash.
Clueless was produced by Robert Lawrence.
Clueless stars Alicia Silverstone.
Clueless stars Paul Rudd.
Clueless stars Brittany Murphy.
Clueless stars Stacey Dash.",001000,1000,000000,t5_small_multiclaim,356,001000,1000,356
1414,889,"Rupert Murdoch was Chairman of News Corporation.
Rupert Murdoch was CEO of 21st Century Fox.
Rupert Murdoch was Chairman of News Corporation.
Rupert Murdoch was CEO of the world's second-largest media conglomerate.",,,,t5_small_multiclaim,,,,
1415,108,"Jon Huntsman Jr. served as the 16th Governor of Utah.
Jon Huntsman Jr. is a businessman.
Jon Huntsman Jr. served as United States Ambassador to Singapore.
Jon Huntsman Jr. is a politician.
Jon Huntsman Jr. is American.",,0000,00000,t5_small_multiclaim,,,,
1416,4251,"Girls' Generation is a South Korean girl group.
Girls' Generation is formed by S.M. Entertainment.
Girls' Generation is a South Korean girl group.
Girls' Generation is formed by S.M. Entertainment.
Girls' Generation is a group.",,,,t5_small_multiclaim,,,,
1417,2427,"Hayden Panettiere is an actress.
Hayden Panettiere is an activist.
Hayden Panettiere is an actress.
Hayden Panettiere is a model.
Hayden Panettiere is an American.
Hayden Panettiere is known for her role as Kairi.
Hayden Panettiere is known for her role as cheerleader Claire Bennet.",,,,t5_small_multiclaim,,,,
1418,5670,"Lithuania is a member of the European Union.
Lithuania is a member of the Council of Europe.
Lithuania is a full member of the Eurozone.
Lithuania is a member of the Schengen Agreement.",1000,01,0000,t5_small_multiclaim,353,1000,01,353
1419,5086,"Hugh Jackman hosted the 81st Academy Awards.
Hugh Jackman hosted the 81st Academy Awards.
Hugh Jackman hosted the 81st Academy Awards.
Hugh Jackman hosted the 81st Academy Awards.",,,,t5_small_multiclaim,,,,
1420,2273,"Marilyn Monroe died in 1962.
Marilyn Monroe died from an overdose of barbiturates.
Marilyn Monroe died at age 36.",,,,t5_small_multiclaim,,,,
1421,5811,"Prometheus was released in 2012.
Prometheus is a film.
Prometheus was released in 2012.
Prometheus was released in 2012.
Prometheus was released in 2012.",,,,t5_small_multiclaim,,,,
1422,4145,"Idris Elba was nominated for a Golden Globe.
Idris Elba was nominated for a Primetime Emmy Award.
Idris Elba was nominated for a Golden Globe Award.
Idris Elba was nominated for a Primetime Emmy Award.",,,,t5_small_multiclaim,,,,
1423,1844,"A Perfect Circle is a rock supergroup.
A Perfect Circle was formed in 1999.
A Perfect Circle is American.
A Perfect Circle is formed by Maynard James Keenan.",,,,t5_small_multiclaim,,,,
1424,3539,"Benin is a country.
Benin is a city.
Benin is in Cotonou.",,,,t5_small_multiclaim,,,,
1425,305,"Matt Smith was in The Ruby in the Smoke.
Matt Smith was in a BBC series.
Matt Smith was in a television series.
Matt Smith was in a BBC series.
Matt Smith was in a BBC series.
Matt Smith was in a television series.",,,,t5_small_multiclaim,,,,
1426,515,"Akshay Kumar is an actor.
Akshay Kumar is a contemporary actor.",,,,t5_small_multiclaim,,,,
1427,12,"Dilwale Dulhania Le Jayenge was shot in Switzerland.
Dilwale Dulhania Le Jayenge was shot in India.
Dilwale Dulhania Le Jayenge was shot from 1994 to 1995.
Dilwale Dulhania Le Jayenge was shot in London.",,,,t5_small_multiclaim,,,,
1428,3721,"Highway to Heaven ran on NBC.
Highway to Heaven ran from 1984 to 1989.
Highway to Heaven is a television drama series.
Highway to Heaven ran on NBC.
Highway to Heaven ran from 1984 to 1989.",,,,t5_small_multiclaim,,,,
1429,3508,"Hush was produced by Trevor Macy.
Hush was produced through Intrepid Pictures.
Hush was produced through Jason Blumhouse Productions banner.
Hush was produced by Trevor Macy.
Hush was produced through a banner.",11010,101,00000,t5_small_multiclaim,356,11010,101,356
1430,5865,"Denmark's constitution ended the absolute monarchy.
Denmark's constitution was signed on June 5th, 1849.",,,,t5_small_multiclaim,,,,
1431,948,"Mixtape is a home-made compilation of music.
Mixtape is a home-made compilation of music.
Mixtape is usually copyrighted songs.
Mixtape is later replaced by CD or MP3 playlist formats.
Mixtape is a home-made compilation of music.
Mixtape is usually on a cassette tape.
Mixtape is later replaced by MP3 playlist formats.
Mixtape is usually a mix-tape.
Mixtape is a home-made compilation of music.
Mix",,,,t5_small_multiclaim,,,,
1432,4393,"David Spade co-starred in Tommy Boy.
David Spade co-starred in Grown Ups.
David Spade co-starred in Joe Dirt 2.
David Spade co-starred in Grown Ups 2.
David Spade co-starred in Black Sheep.",,,,t5_small_multiclaim,,,,
1433,1838,"Paranormal is a phenomenon.
Paranormal is a phenomenon.
Paranormal is a phenomenon.
Paranormal is a phenomenon.",,,,t5_small_multiclaim,,,,
1434,5469,"Golden State Warriors was renamed the San Francisco Warriors.
Golden State Warriors relocated to the San Francisco Bay Area in 1962.
Golden State Warriors were renamed the San Francisco Warriors.
Golden State Warriors were renamed the San Francisco Warriors.
Golden State Warriors were renamed the San Francisco Warriors.
Golden State Warriors were renamed the San Francisco Warriors.",,,,t5_small_multiclaim,,,,
1435,343,"Roger Moore was born in 1927.
Roger Moore was an actor.
Roger Moore was English.
Roger Moore was born in 1927.",,,,t5_small_multiclaim,,,,
1436,795,"Emily Dickinson's poems are unique for the era in which she wrote.
Emily Dickinson's poems often lack titles.",,,,t5_small_multiclaim,,,,
1437,5957,"American Gods is a novel.
American Gods was written by a writer.
American Gods was written by a writer.
American Gods was written by a writer.",,,,t5_small_multiclaim,,,,
1438,5536,"Prisoner is set in a fictional women's prison.
Prisoner is a soap opera.
Prisoner is set in a prison.
Prisoner is set in a fictional prison.
Prisoner is set in a prison.
Prisoner is set in a fictional prison.
Prisoner is set in a prison.
Prisoner is set in a prison.
Prisoner is set in a prison.
Prisoner is set in a prison.
Prisoner is set in a prison.
Prisoner is Australian.
Prisoner is set",,,,t5_small_multiclaim,,,,
1439,1150,"Jennifer Hudson is a new coach in The Voice.
Jennifer Hudson is a new coach in The Voice.",,,,t5_small_multiclaim,,,,
1440,785,"FC Barcelona won five trophies in 2011.
FC Barcelona became European champions again.",00,10,00,t5_small_multiclaim,354,"00,00","10,00","354,356"
1441,1404,"Tiger Woods won this tournament.
Tiger Woods pocketed $46,000.
Tiger Woods won this tournament.
Tiger Woods won by 12 strokes.",,,,t5_small_multiclaim,,,,
1442,4387,"Justice League is based on the DC Comics superhero team.
Justice League is a film.
Justice League is a superhero film.
Justice League is based on the DC Comics superhero team.
Justice League is distributed by Warner Bros.",,,,t5_small_multiclaim,,,,
