id,acl_sentence,claim,annotation,user,cross_annotations,cross_users
9659,795,Emily Dickinson's poems deal with themes of death and immortality.,,,,
9660,795,Emily Dickinson's poems typically lack titles.,,,,
9661,795,Emily Dickinson's poems often use slant rhyme.,,,,
9662,5957,American Gods is based on a novel by Neil Gaiman.,,,,
9663,5957,American Gods is a television adaptation.,,,,
9664,5957,American Gods airs on Starz.,,,,
9665,5957,American Gods began airing in April 2017.,,,,
9666,5536,Prisoner is a television series.,,,,
9668,5536,Prisoner is set in an Australian soap opera.,,,,
9669,5536,Prisoner is set in Wentworth Detention Centre.,,,,
9670,1150,The Voice is on NBC.,,,,
9671,1150,The Voice has Jennifer Hudson as a coach.,,,,
9672,1150,The Voice is a TV series.,,,,
9673,785,FC Barcelona is a sports club.,3311,354,"3311,3311","354,356"
9674,785,FC Barcelona plays football.,3311,354,"3311,3311","354,356"
9675,785,FC Barcelona won five trophies in 2011.,3311,354,"3311,3311","354,356"
9677,1404,Tiger Woods won a major tournament.,,,,
9678,1404,Tiger Woods won a golf tournament played at Augusta National Golf Club.,,,,
9679,1404,Tiger Woods won the Masters in 1997.,,,,
9680,1404,Tiger Woods won a tournament by 12 strokes.,,,,
9681,1404,"Tiger Woods won $486,000 for winning the Masters in 1997.",,,,
9682,4387,Justice League is a film.,,,,
9683,4387,Justice League is distributed by Warner Bros.,,,,
9684,4387,Justice League is based on the DC Comics superhero team of the same name.,,,,
9686,1994,Seven Days in May stars an American actor born in 1913.,,,,
9687,1994,Seven Days in May stars a film director.,,,,
9688,1994,Seven Days in May stars Fredric March.,,,,
9689,1994,Seven Days in May stars Burt Lancaster.,,,,
9690,1994,Seven Days in May stars Ava Gardner.,,,,
9692,227,Margot Kidder performed on R.L. Stine's The Haunting Hour.,,,,
9693,227,Margot Kidder is an actress.,,,,
9694,3090,Zinedine Zidane won an award given by an Italian sports newspaper.,,,,
9695,3090,Zinedine Zidane won the La Liga Best Foreign Player award in 2002.,,,,
9696,3090,Zinedine Zidane won the Serie A Footballer of the Year award in 2001.,,,,
9697,3090,Zinedine Zidane won the Ligue 1 Player of the Year award in 1996.,,,,
9698,4223,The United Kingdom was the world's first industrialized country.,,,,
9699,4223,The United Kingdom was a great power.,,,,
9700,4223,The United Kingdom was the world's foremost power.,,,,
9701,6405,Brazil is a country.,,,,
9702,6405,Brazil has unique environmental heritage.,,,,
9703,6405,Brazil is the subject of significant global interest and debate.,,,,
9705,1859,Crown colonies are also known as British Overseas Territories.,3311,356,"3311,3311","356,360"
9706,1859,Crown colonies were ruled by a governor appointed by the monarch.,3311,356,"3311,3311","356,360"
9707,1859,Crown colonies were a type of colonial administration.,3311,356,"3311,3301","356,360"
9708,1859,Crown colonies were also known as royal colonies.,3311,356,"3311,3311","356,360"
9709,1859,Crown colonies were part of the British Empire.,3311,356,"3311,3311","356,360"
9711,5712,Prometheus required technology to be developed.,,,,
9712,5712,Prometheus entered production in 2010.,,,,
9713,5712,Prometheus required creatures to be developed.,,,,
9714,5712,Prometheus entered production with extensive design phases.,,,,
9715,5712,Prometheus is a film.,,,,
9720,2332,Taiwan's high-tech industry plays a key role in the global economy.,,,,
9721,2332,Taiwan is a country.,,,,
9722,3589,Dan Aykroyd was nominated for the Academy Award for Best Supporting Actor.,,,,
9723,3589,Dan Aykroyd worked in Driving Miss Daisy.,,,,
9724,3589,Dan Aykroyd was nominated for an Academy Award.,,,,
9725,3589,Dan Aykroyd worked with Bruce Nelson.,,,,
9726,3589,Dan Aykroyd worked with Morgan Freeman.,,,,
9727,4324,Muammar Gaddafi was internationally condemned as a dictator.,,,,
9728,4324,Muammar Gaddafi's social and economic reforms were strongly opposed by Islamic fundamentalists.,,,,
9729,4324,Muammar Gaddafi violated the human rights of Libyan citizens.,,,,
9730,4324,Muammar Gaddafi was internationally condemned as a human rights violator.,,,,
9731,4324,Muammar Gaddafi financed global terrorism.,,,,
9732,3690,Harry Potter and the Deathly Hallows is a novel.,,,,
9733,3690,Harry Potter and the Deathly Hallows chronicles the events following Harry Potter and the Half-Blood Prince.,,,,
9735,3690,Harry Potter and the Deathly Hallows was written by J.K. Rowling.,,,,
9736,1211,Snowpiercer was written by Kelly Masterson.,,,,
9737,1211,Snowpiercer was directed by Bong Joon-ho.,,,,
9738,318,Zooey Deschanel performed in the jazz cabaret act If All the Stars Were Pretty Babies.,,,,
9740,318,Zooey Deschanel is an actress.,,,,
9741,318,Zooey Deschanel performed in the early 2000's.,,,,
9742,1076,Anni-Frid Lyngstad is a Swedish singer.,,,,
9743,1076,Anni-Frid Lyngstad was born in 1945.,,,,
9744,1076,Anni-Frid Lyngstad is a jazz singer.,,,,
9745,1076,Anni-Frid Lyngstad was born in November.,,,,
9746,1076,Anni-Frid Lyngstad is a pop singer.,,,,
9747,3470,Eric Trump is the second son of Donald Trump.,,,,
9749,3470,Eric Trump's mother is Ivana Trump.,,,,
9750,3470,Eric Trump's father is the President of the United States.,,,,
9751,1705,Star Wars sequel trilogy includes Star Wars: The Last Jedi.,,,,
9752,1705,Star Wars sequel trilogy is in production.,,,,
9753,1705,Star Wars sequel trilogy is a film series.,,,,
9754,5708,Kiiara is a singer.,3311,354,3311,354
9757,5708,Kiiara is an American.,3311,354,3311,354
9758,3663,Susan Atkins was a female inmate.,,,,
9759,3663,Susan Atkins was the longest-serving female inmate in California.,,,,
9760,3663,Susan Atkins died.,,,,
9762,147,Kenny Rogers has an album called Kenny.,,,,
9763,147,Kenny Rogers has an album called The Gambler.,,,,
9764,147,Kenny Rogers has released at least two albums.,,,,
9765,147,Kenny Rogers has influenced country music.,,,,
9766,6198,The blue whale's diet consists almost exclusively of krill.,,,,
9767,6198,The blue whale is a baleen whale.,,,,
9768,6198,The blue whale eats crustaceans.,,,,
9771,606,R. Kelly is a musician.,2311,354,"2311,3311","354,356"
9772,606,R. Kelly is the most successful R&B male artist of the 1990s.,3311,354,"3311,3311","354,356"
9773,3992,The Cincinnati Kid was directed by Norman Jewison.,,,,
9774,3992,The Cincinnati Kid stars Steve McQueen.,,,,
9775,3992,The Cincinnati Kid is a film.,,,,
9776,3992,The Cincinnati Kid stars Edward G. Robinson as Howard.,,,,
9777,5565,The International Space Station is a research laboratory.,,,,
9778,5565,The International Space Station has crew members.,,,,
9779,2837,Ruth Negga has appeared in television roles.,,,,
9780,2837,Ruth Negga has played roles in the BBC's mini-series Criminal Justice.,,,,
9781,2837,Ruth Negga has played roles in ABC's Marvel's Agents of S.H.I.E.L.D.,,,,
9782,2837,Ruth Negga has played roles in E4's Misfits.,,,,
9783,2837,Ruth Negga has played roles in RTÉ's Love/Hate.,,,,
9784,2238,Spider-Man is based on a comic book character.,,,,
9785,2238,Spider-Man is a film.,,,,
9786,2238,Spider-Man's high school experiences are central to the plot.,,,,
9787,1293,Emily Dickinson was born in 1830.,,,,
9788,1293,Emily Dickinson was a poet.,,,,
9789,1293,Emily Dickinson died in 1886.,,,,
9794,2721,Sayyeshaa is a film actress.,,,,
9795,1716,Minions was produced by Janet Healy.,,,,
9796,1716,Minions was directed by Kyle Balda.,,,,
9797,1716,Minions was produced by Chris Meledandri.,,,,
9798,1716,Minions was written by Brian Lynch.,,,,
9799,1716,Minions was directed by Pierre Coffin.,,,,
9800,2894,Whitney Houston was found dead in her guest room.,,,,
9802,2894,"Whitney Houston was found dead in Beverly Hills, California.",,,,
9803,2894,"Whitney Houston was dead on February 11, 2012.",,,,
9804,1981,Donald Glover is a musician.,,,,
9805,1981,Donald Glover released Because the Internet in 2013.,,,,
9806,1981,Donald Glover is an American.,,,,
9807,1981,Donald Glover released his second album in 2013.,,,,
9808,1981,Donald Glover is a rapper.,,,,
9809,3769,Dennis Hastert lost a 1980 bid for the Illinois House of Representatives.,,,,
9810,3769,Dennis Hastert won a seat in 1981.,,,,
9811,64,Hayden Panettiere portrayed Kirby Reed.,,,,
9812,64,Hayden Panettiere portrayed Amanda Knox.,,,,
9814,6257,The Beatles had successful musical careers.,,,,
9815,159,Seinfeld was written by David and Seinfeld.,3311,356,3311,356
9816,159,Seinfeld had script writers.,3311,356,3311,356
9817,2263,Jon Huntsman Jr. was appointed by George H.W. Bush.,,,,
9818,2263,Jon Huntsman Jr. began his career as a White House staff assistant.,,,,
9819,2263,Jon Huntsman Jr. was appointed Deputy Assistant Secretary of Commerce.,,,,
9820,2263,Jon Huntsman Jr. was United States Ambassador to Singapore.,,,,
9821,4103,Philip V of Spain had two reigns.,,,,
9822,4103,Philip V of Spain reigned for 45 years and 21 days.,,,,
9824,2704,Matt Groening won a British Comedy Award in 2004.,,,,
9825,914,Jackfruit is a multiple fruit.,3311,355,3311,355
9826,914,Jackfruit is composed of hundreds to thousands of individual flowers.,3311,355,3311,355
9827,914,Jackfruit is a fruit.,3311,355,3311,355
9828,914,Jackfruit is composed of flowers.,3311,355,3311,355
9829,914,Jackfruit is a food item.,3311,355,3311,355
9830,1902,Denzel Washington has received three Golden Globe awards.,,,,
9831,1902,Denzel Washington received a Tony Award.,,,,
9832,1902,Denzel Washington is an actor.,,,,
9833,1902,Denzel Washington was in the film Glory.,,,,
9834,1902,Denzel Washington was in the film Training Day.,,,,
9836,3600,Ron Weasley is a member of a student house at Hogwarts.,2311,354,2311,354
9837,3600,Ron Weasley went to school with Harry Potter.,2311,354,2311,354
9838,97,Back to the Future Part II is the second installment in the Back to the Future trilogy.,,,,
9840,97,Back to the Future Part II is a film.,,,,
9841,3221,Zinedine Zidane received the Golden Ball for player of the tournament at the 2006 World Cup.,,,,
9842,3221,Zinedine Zidane was sent off for headbutting Marco Materazzi in the chest.,,,,
9843,3221,Zinedine Zidane was named player of the tournament at the 2006 World Cup.,,,,
9844,3221,Zinedine Zidane was in the World Cup final against Italy.,,,,
9845,3221,Zinedine Zidane was sent off in the final,,,,
9846,4184,"Norway has existed for 1,144 years.",,,,
9847,4184,Norway has had over sixty kings and earls.,,,,
9848,4184,Norway is a kingdom.,,,,
9849,1141,Winona Ryder was nominated for a Screen Actors Guild Award for her role in When Love Is Not Enough: The Lois Wilson Story.,,,,
9850,1141,Winona Ryder was nominated for a Screen Actors Guild Award for her role in Black Swan.,,,,
9852,5694,Akshay Kumar was ranked 9th in Forbes' first global list of highest-paid actors.,,,,
9853,5694,Akshay Kumar is an actor.,,,,
9854,5694,Akshay Kumar was in Forbes.,,,,
9855,5694,Akshay Kumar was ranked highest-paid actors in the world.,,,,
9856,5694,Akshay Kumar was in a list in 2015.,,,,
9857,508,Minnesota has a high standard of living.,,,,
9858,508,Minnesota is among the wealthiest states in the US.,,,,
9859,508,Minnesota is one of the best-educated states in the US.,,,,
9862,4519,"Room premiered on September 4th, 2015.",,,,
9863,4519,"Room had a limited release on October 16th, 2015.",,,,
9864,4519,"Room premiered at an annual film festival in Telluride, Colorado.",,,,
9865,4519,Room premiered in 2015.,,,,
9866,4519,"Room premiered in Telluride, Colorado.",,,,
9867,4519,Room premiered at,,,,
9868,4794,Before Night Falls is a film.,,,,
9869,4794,Before Night Falls is a biographical film.,,,,
9870,4794,Before Night Falls is a romantic drama film.,,,,
9871,4794,Before Night Falls is a film that was released in the year 2000.,,,,
9872,4794,Before Night Falls is an American film.,,,,
9873,4794,Before Night Falls was directed by Julian Schnabel.,,,,
9874,3697,"The United Kingdom is made up of England, Scotland, Wales, and Northern Ireland.",,,,
9875,3697,The United Kingdom is made up of four countries.,,,,
9876,1378,The Walt Disney Company is headquartered in California.,,,,
9877,1378,The Walt Disney Company is a multinational conglomerate.,,,,
9878,1378,The Walt Disney Company is involved in mass media and entertainment.,,,,
9879,1378,The Walt Disney Company is American.,,,,
9882,290,Madonna was signed to an auxiliary label of Warner Bros.,,,,
9883,290,Records.,,,,
9884,290,Madonna released her debut album in the middle of the 1980s.,,,,
9885,88,The United States Army is a branch of the armed forces.,,,,
9886,88,The United States Army participates in conflicts worldwide.,,,,
9888,3977,Pan Am premiered in 2011.,,,,
9889,3977,Pan Am premiered on ABC.,,,,
9890,3977,Pan Am ended in 2012.,,,,
9891,3977,Pan Am premiered on September 25.,,,,
9892,3977,Pan Am ended on February 19.,,,,
9894,3873,Benin is highly dependent on agriculture.,,,,
9895,3873,Benin has substantial employment and income arising from subsistence farming.,,,,
9896,4888,Ozzy Osbourne was inducted into the UK Music Hall of Fame.,,,,
9897,4888,Ozzy Osbourne was inducted into the Rock and Roll Hall of Fame.,,,,
9898,4888,Ozzy Osbourne was a member of Black Sabbath.,,,,
9899,4888,Ozzy Osbourne was inducted as a solo artist.,,,,
9900,4888,Ozzy Osbourne was inducted as a member of the band.,,,,
9902,1457,Oscar Wilde wrote in different forms throughout the 1880s.,,,,
9905,2353,Adrian Molina is a screenwriter.,,,,
9906,2353,Adrian Molina co-directed an Pixar film.,,,,
9907,2353,Adrian Molina wrote for an Pixar film.,,,,
9908,3229,"Marble Hill, Manhattan is on the mainland of North America.",,,,
9909,3229,"Marble Hill, Manhattan is in the borough of Manhattan.",,,,
9910,3229,"Marble Hill, Manhattan is a neighborhood.",,,,
9911,3229,"Marble Hill, Manhattan is in New York City.",,,,
9912,3229,"Marble Hill, Manhattan is on an island.",,,,
9913,113,Canada was inhabited by Aboriginal peoples.,,,,
9914,113,Canada was colonized by the French and the British.,,,,
9915,113,Canada was the location of the first European arrivals in the New World.,,,,
9917,3058,The Minnesota Vikings lost each of their Super Bowl appearances.,,,,
9918,697,Ecuador is a country in South America.,,,,
9919,697,Ecuador is officially the Republic of Ecuador.,,,,
9921,697,Ecuador is bordered by Colombia on the north.,,,,
9922,697,Ecuador is bordered by Peru on the east and south.,,,,
9925,5035,Venice is a city.,,,,
9927,579,FC Barcelona was founded by a group of football players.,,,,
9928,579,FC Barcelona was founded in 1899.,,,,
9929,579,FC Barcelona is a football club.,,,,
9930,579,FC Barcelona was founded by Joan Gamper.,,,,
9931,1730,The Jackson family is an American family.,,,,
9932,1730,The Jackson family is a family of singers.,,,,
9933,1730,"The Jackson family originated in Gary, Indiana.",,,,
9934,5513,Jackie is a biographical drama film.,,,,
9935,5513,Jackie was directed by Pablo Larraín.,,,,
9936,5513,Jackie was written by Noah Oppenheim.,,,,
9937,5513,Jackie is a film.,,,,
9938,5513,Jackie stars Natalie Portman as Jackie Kennedy.,,,,
9939,5041,The Weeknd is a Canadian singer.,,,,
9940,5041,The Weeknd released his first album in 2013.,,,,
9941,5041,The Weeknd's album debuted at number two on the Billboard 200.,,,,
9942,5041,The Weeknd is a musician.,,,,
9943,803,Sherlock is a TV series.,,,,
9944,803,Sherlock has at least three series.,,,,
9945,146,Donald Glover was nominated for Best Rap Performance.,,,,
9947,146,Donald Glover was nominated for Best Rap Album.,,,,
9948,146,Donald Glover released Because the Internet in 2013.,,,,
9949,146,Donald Glover released a studio album.,,,,
9950,1778,Futurama has been made into a video game.,,,,
9952,1778,Futurama has been made into a calendar.,,,,
9953,1778,Futurama has been made into a figure.,,,,
9954,1778,Futurama has been made into clothes.,,,,
9955,719,Cupid is a television series.,,,,
9956,719,Cupid aired in 2009.,,,,
9958,719,Cupid aired on Tuesdays at 10:02 PM Eastern/9:02 PM Central.,,,,
9959,719,Cupid is a comedy-drama.,,,,
9960,2142,Stardust was co-written by Jane Goldman.,,,,
9961,2142,Stardust was directed by Matthew Vaughn.,,,,
9962,5739,London is in England.,,,,
9963,5739,London is the administrative boundaries of the capital of England.,,,,
9965,5739,London is part of the United Kingdom.,,,,
9967,669,Physical Graffiti is by Led Zeppelin.,,,,
9968,669,Physical Graffiti was released in 1975.,,,,
9969,27,Marilyn Monroe worked in a factory.,,,,
9970,27,Marilyn Monroe was a pin-up model.,,,,
9971,27,Marilyn Monroe was introduced to a photographer.,,,,
9972,994,Dan Martin (cyclist) is an Irish professional road racing cyclist.,,,,
9973,994,"Dan Martin (cyclist) was born on August 20, 1986.",,,,
9974,994,Dan Martin (cyclist) is also known as Daniel Martin.,,,,
9975,994,Dan Martin (cyclist) rides for UCI ProTeam.,,,,
9978,2793,Joan of Arc is a Saint.,,,,
9979,3639,Rhode Island was the first of the Thirteen Colonies to renounce its allegiance to the British Crown.,,,,
9980,3639,Rhode Island was the fourth among the newly sovereign states to ratify the Articles of Confederation.,,,,
9981,1186,Muammar Gaddafi transformed Libya into a new socialist state.,,,,
9982,1186,Muammar Gaddafi was head of the military.,,,,
9983,1186,Muammar Gaddafi was head of the Revolutionary Committees.,,,,
9984,1186,Muammar Gaddafi remained head of both the military and the Revolutionary Committees.,,,,
9985,1186,Muammar Gaddafi officially adopted a symbolic role in governance.,,,,
9986,1834,Prometheus's leading actors had roles in television series.,2311,354,2311,354
9987,1834,Prometheus's leading actors have been in films.,2311,354,2311,354
9988,1834,Prometheus's leading actors are part of a science fiction film.,1311,354,1311,354
9989,1834,Prometheus's leading actors have won awards.,2311,354,2311,354
9990,1633,Gone with the Wind is a film.,,,,
9991,1633,Gone with the Wind was the highest-earning film for over a quarter of a century.,,,,
9992,1633,Gone with the Wind was popular.,,,,
9993,3427,Julian Assange expressed concern about being extradited to the United States.,,,,
9995,5882,My Summer of Love is a 2004 British drama film.,,,,
9996,5882,My Summer of Love was co-written by Michael Wynne.,,,,
9997,5882,My Summer of Love was directed by Pawel Pawlikowski.,,,,
9999,4410,Rod Laver won a Pro Slam title in 1967.,,,,
10000,6361,Iran had conflicts with the Russian Empire.,,,,
10001,6361,Iran experienced popular unrest.,,,,
10002,6361,Iran lost significant territory.,,,,
10003,1023,In Secret is based on a novel by Émile Zola.,,,,
10004,1023,In Secret is based on Thérèse Raquin.,,,,
10005,1023,In Secret stars Elizabeth Olsen.,,,,
10006,1023,In Secret stars Tom Felton.,,,,
10007,1023,In Secret stars Oscar Isaac.,,,,
10008,1023,In Secret stars Jessica Lange.,,,,
10009,1023,In Secret is a film.,,,,
10010,4043,Hugh Jackman was nominated for an Academy Award.,3311,356,3311,356
10011,4043,Hugh Jackman was in Les Misérables.,3311,356,3311,356
10012,4043,Hugh Jackman won a Golden Globe Award.,3311,356,3311,356
10014,2369,Spider-Man is a superhero.,,,,
10016,2369,Spider-Man lives with his Aunt May and Uncle Ben.,,,,
10018,911,The Voice is an American television series.,,,,
10021,5169,Tennis is a sport played on a rectangular court.,,,,
10022,5169,Tennis has connections to various field games.,,,,
10023,5169,Tennis is a racket sport.,,,,
10024,5169,"Tennis originated in Birmingham, England.",,,,
10025,5169,Tennis has connections to the older racket sport of real tennis.,,,,
10026,6633,Empathy is the capacity to understand or feel what another person is experiencing.,3311,356,3311,356
10027,6633,Empathy is the capacity to place oneself in another's position.,3311,356,3311,356
10028,1983,Nazi Germany suffered major military defeats in 1943.,,,,
10029,1983,Nazi Germany was pushed back in Eastern and Southern Europe.,,,,
10030,1983,Nazi Germany was invaded by the Soviet Union in 1941.,,,,
10031,1983,Nazi Germany suffered large-scale aerial bombing in 1944.,,,,
10032,4940,The International Space Station is suited for testing spacecraft systems.,,,,
10033,4940,The International Space Station maintains an orbit.,,,,
10034,4940,The International Space Station is suited for testing equipment required for missions to the Moon and Mars.,,,,
10035,2342,Code Geass has been adapted into various manga.,3311,360,"3311,3311","360,356"
10037,1463,Roald Dahl became an intelligence officer.,,,,
10038,1463,Roald Dahl rose to the rank of acting wing commander.,,,,
10041,1463,Roald Dahl served in the Royal Air Force.,,,,
10043,1463,Roald Dahl was born to Norwegian parents.,,,,
10046,1463,Roald,,,,
10047,5947,Marilyn Monroe was a top-billed actress.,,,,
10048,5947,Marilyn Monroe's films grossed $200 million.,,,,
10050,2220,The Nilotic peoples include all descendants of the original Nilo-Saharan speakers.,,,,
10051,2220,The Nilotic peoples are a sub-group of the Nilo-Saharan languages.,,,,
10052,2220,The Nilotic peoples are indigenous to the Nile Valley.,,,,
10053,2220,The Nilotic peoples speak Nilotic languages.,,,,
10054,2220,The Nilotic peoples are a large sub-group of the Nilo-Saharan languages.,,,,
10055,2220,The Nilotic peoples speak languages that are,,,,
10056,3647,Salman Khan was in several top-grossing productions.,,,,
10057,3647,Salman Khan is an actor.,,,,
10058,3647,Salman Khan was in Hum Aapke Hain Koun.,,,,
10060,4247,The Blue Whale has a body.,,,,
10061,4247,The Blue Whale is long and slender.,,,,
10062,4247,The Blue Whale was named after a whale from Norse mythology.,,,,
10063,4247,The Blue Whale has a maximum recorded weight of 173 tonnes.,,,,
10064,3845,Sally Field is an actress.,,,,
10065,3845,Sally Field starred in Places in the Heart.,,,,
10066,3845,Sally Field received an Academy Award for Best Actress.,,,,
10067,3845,Sally Field received a Golden Globe Award nomination for Absence of Malice.,,,,
10068,4861,Brock Lesnar is a mixed martial artist.,,,,
10069,4861,Brock Lesnar is a heavyweight.,,,,
10070,4861,Brock Lesnar is a UFC champion.,,,,
10071,4861,Brock Lesnar defeated Randy Couture.,,,,
10073,2129,Mithun Chakraborty starred in Tahader Katha.,,,,
10074,2129,Mithun Chakraborty starred in Swami Vivekananda.,,,,
10075,2325,Mackenzie Foy is a model.,,,,
10077,2325,Mackenzie Foy was born in 2000.,,,,
10079,5746,James McAvoy was in a Golden Globe-nominated film.,,,,
10080,5746,James McAvoy was in a romantic drama film.,,,,
10081,5746,James McAvoy was in a film directed by Joe Wright.,,,,
10082,5746,James McAvoy was in the film Atonement.,,,,
10083,5746,James McAvoy was nominated for a BAFTA.,,,,
10084,3543,Seth Rogen received critical praise for his performance.,,,,
10085,3543,Seth Rogen was cast as the lead in two films.,,,,
10086,3543,Seth Rogen was cast in a major supporting role.,,,,
10087,3543,Seth Rogen was credited as a co-producer.,,,,
10088,3543,Seth Rogen worked with Apatow.,,,,
10089,5480,Ozzy Osbourne has sold over 100 million albums.,,,,
10090,5480,Ozzy Osbourne was in Black Sabbath.,,,,
10091,5480,Ozzy Osbourne has solo work.,,,,
10092,656,Walt Disney died in December 1966.,,,,
10093,656,Walt Disney had lung cancer.,,,,
10095,656,Walt Disney was a man.,,,,
10096,26,Colombia borders Brazil to the east.,,,,
10097,26,Colombia borders Venezuela to the east.,,,,
10098,26,Colombia borders Ecuador to the south.,,,,
10099,26,Colombia borders Panama to the northwest.,,,,
10100,26,Colombia is a country.,,,,
10101,195,Venice is located between the mouths of two rivers.,,,,
10102,195,Venice is located in a shallow Venetian Lagoon.,,,,
10103,195,Venice is located in an enclosed bay.,,,,
10104,3151,Costa Rica is officially recognized as a Christian nation.,,,,
10105,3151,Costa Rica is a Christian state.,,,,
10106,3151,Costa Rica has a state church.,,,,
10107,3151,Costa Rica is a developed country.,,,,
10108,3151,Costa Rica is a stable democracy.,,,,
10109,2236,Tokyo is the capital of Japan.,,,,
10110,2236,Tokyo was the seat of government since 1603.,,,,
10111,2236,Tokyo was officially made the capital in 1868.,,,,
10113,5917,Salman Khan is an actor.,,,,
10114,5917,Salman Khan has acted in the highest-grossing Bollywood films of nine separate years.,,,,
10116,168,Serbia is ranked 48th on the Global Peace Index.,,,,
10117,168,Serbia is ranked 66th on the Human Development Index.,,,,
10118,168,Serbia is ranked 47th on the Social Progress Index.,,,,
10119,178,Margot Kidder performed on Broadway in a 2002 production of The Vagina Monologues.,,,,
10120,178,Margot Kidder was an actress who worked in theatrical productions.,,,,
10122,1065,Dennis Hastert was re-elected to the United States House of Representatives multiple times.,,,,
10124,5332,The British Fantasy Award was renamed in 1976.,,,,
10125,5332,The British Fantasy Award has 13 categories.,,,,
10126,5332,The British Fantasy Award was originally just for novels.,,,,
10127,5332,The British Fantasy Award includes an award for Best Novella.,,,,
10128,5332,The British Fantasy Award includes an award for Best Short Story.,,,,
10129,1170,Room is a film.,,,,
10130,1170,Room was nominated for an Academy Award.,,,,
10131,2312,Miley Cyrus is a songwriter.,,,,
10132,2312,Miley Cyrus is an actress.,,,,
10133,2312,Miley Cyrus was born in November.,,,,
10134,2312,Miley Cyrus is an American.,,,,
10135,2312,Miley Cyrus is a singer.,,,,
10136,5396,William Shakespeare wrote plays.,,,,
10138,5396,William Shakespeare wrote tragicomedies.,,,,
10139,528,Minnesota was inhabited by the Ojibwe/Anishinaabe.,,,,
10140,528,Minnesota was inhabited by the Dakota.,,,,
10143,5881,Iran's land area is 1648195 square kilometers.,,,,
